id,name,hp,types,abilities,weaknesses,resistances,convertedRetreatCost,artist,rarity,flavorText,images
ex11-3,Dragonite δ,100,"['Lightning', 'Metal']","[{'name': 'Delta Charge', 'text': ""Once during your turn (before your attack), you may attach a Lightning Energy card from your discard pile to 1 of your Benched Pokémon. This power can't be used if Dragonite is affected by a Special Condition."", 'type': 'Poké-Power'}]","[{'type': 'Colorless', 'value': '×2'}]","[{'type': 'Grass', 'value': '-30'}, {'type': 'Fighting', 'value': '-30'}]",2,Ryo Ueda,Rare Holo,,"{'small': 'https://images.pokemontcg.io/ex11/3.png', 'large': 'https://images.pokemontcg.io/ex11/3_hires.png'}"
ex13-2,Cradily δ,100,"['Darkness', 'Metal']",,"[{'type': 'Fire', 'value': '×2'}]",,2,Kouki Saitou,Rare Holo,,"{'small': 'https://images.pokemontcg.io/ex13/2.png', 'large': 'https://images.pokemontcg.io/ex13/2_hires.png'}"
gym2-2,Blaine's Charizard,100,['Fire'],,"[{'type': 'Water', 'value': '×2'}]","[{'type': 'Fighting', 'value': '-30'}]",3,Ken Sugimori,Rare Holo,,"{'small': 'https://images.pokemontcg.io/gym2/2.png', 'large': 'https://images.pokemontcg.io/gym2/2_hires.png'}"
det1-3,Morelull,50,['Grass'],,"[{'type': 'Fire', 'value': '×2'}]",,1,MPC Film,Common,"It scatters its shining spores around itself. Even though they're dangerous, nighttime tours of forests where Morelull live are popular.","{'small': 'https://images.pokemontcg.io/det1/3.png', 'large': 'https://images.pokemontcg.io/det1/3_hires.png'}"
pop7-2,Gallade,130,['Fighting'],,"[{'type': 'Psychic', 'value': '+30'}]",,2,Daisuke Ito,Rare,"A master of courtesy and swordsmanship, it fights using extending swords on it elbows.","{'small': 'https://images.pokemontcg.io/pop7/2.png', 'large': 'https://images.pokemontcg.io/pop7/2_hires.png'}"
col1-2,Deoxys,80,['Psychic'],,"[{'type': 'Psychic', 'value': '×2'}]",,1,Ryo Ueda,Rare Holo,DNA from a space virus mutated and became a Pokémon. It appears where auroras are seen.,"{'small': 'https://images.pokemontcg.io/col1/2.png', 'large': 'https://images.pokemontcg.io/col1/2_hires.png'}"
pl1-3,Blaziken,130,['Fire'],"[{'name': 'Fire Breath', 'text': ""Once during your turn (before your attack), you may choose 1 of the Defending Pokémon. That Pokémon is now Burned. This power can't be used if Blaziken is affected by a Special Condition."", 'type': 'Poké-Power'}]","[{'type': 'Water', 'value': '+30'}]",,1,Hajime Kusajima,Rare Holo,,"{'small': 'https://images.pokemontcg.io/pl1/3.png', 'large': 'https://images.pokemontcg.io/pl1/3_hires.png'}"
sm115-2,Metapod,90,['Grass'],,"[{'type': 'Fire', 'value': '×2'}]",,2,Shibuzoh.,Uncommon,Its shell is filled with a thick liquid. All of the cells throughout its body are being rebuilt in preparation for evolution.,"{'small': 'https://images.pokemontcg.io/sm115/2.png', 'large': 'https://images.pokemontcg.io/sm115/2_hires.png'}"
sm2-1,Bellsprout,60,['Grass'],,"[{'type': 'Fire', 'value': '×2'}]",,1,Aya Kusube,Common,"Even though its body is extremely skinny, it is blindingly fast when catching its prey.","{'small': 'https://images.pokemontcg.io/sm2/1.png', 'large': 'https://images.pokemontcg.io/sm2/1_hires.png'}"
ex4-1,Team Aqua's Cacturne,80,"['Grass', 'Darkness']",,"[{'type': 'Fire', 'value': '×2'}]",,2,K. Utsunomiya,Rare Holo,,"{'small': 'https://images.pokemontcg.io/ex4/1.png', 'large': 'https://images.pokemontcg.io/ex4/1_hires.png'}"
bw9-1,Weedle,50,['Grass'],,"[{'type': 'Fire', 'value': '×2'}]",,1,Sumiyoshi Kizuki,Common,It eats its weight in leaves every day. It fends off attackers with the needle on its head.,"{'small': 'https://images.pokemontcg.io/bw9/1.png', 'large': 'https://images.pokemontcg.io/bw9/1_hires.png'}"
ex3-1,Absol,70,['Darkness'],,"[{'type': 'Fighting', 'value': '×2'}]","[{'type': 'Psychic', 'value': '-30'}]",1,Naoyo Kimura,Rare Holo,,"{'small': 'https://images.pokemontcg.io/ex3/1.png', 'large': 'https://images.pokemontcg.io/ex3/1_hires.png'}"
hgss1-1,Arcanine,110,['Fire'],,"[{'type': 'Water', 'value': '×2'}]",,2,Naoki Saito,Rare Holo,This legendary Chinese Pokémon is considered magnificent. Many people are enchanted by its grand mane.,"{'small': 'https://images.pokemontcg.io/hgss1/1.png', 'large': 'https://images.pokemontcg.io/hgss1/1_hires.png'}"
base3-1,Aerodactyl,60,['Fighting'],"[{'name': 'Prehistoric Power', 'text': 'No more Evolution cards can be played. This power stops working while Aerodactyl is Asleep, Confused, or Paralyzed.', 'type': 'Pokémon Power'}]","[{'type': 'Grass', 'value': '×2'}]","[{'type': 'Fighting', 'value': '-30'}]",2,Kagemaru Himeno,Rare Holo,A ferocious prehistoric Pokémon that goes for the enemy's throat with its serrated saw-like fangs.,"{'small': 'https://images.pokemontcg.io/base3/1.png', 'large': 'https://images.pokemontcg.io/base3/1_hires.png'}"
dp3-2,Blastoise,120,['Water'],"[{'name': 'Waterlog', 'text': ""Once during your turn (before your attack), you may attach as many basic Water Energy cards from your hand to any of your Pokémon in any way you like. If you do, your turn ends. This power can't be used if Blastoise is affected by a Special Condition."", 'type': 'Poké-Power'}]","[{'type': 'Lightning', 'value': '+30'}]",,2,Daisuke Ito,Rare Holo,The jets of water it spouts from the rocket cannons on its shell can punch through thick steel.,"{'small': 'https://images.pokemontcg.io/dp3/2.png', 'large': 'https://images.pokemontcg.io/dp3/2_hires.png'}"
xy2-2,Metapod,70,['Grass'],"[{'name': 'Adaptive Evolution', 'text': 'This Pokémon can evolve during your first turn or the turn you play it.', 'type': 'Ability'}]","[{'type': 'Fire', 'value': '×2'}]",,2,kawayoo,Uncommon,A steel-hard shell protects its tender body. It quietly endures hardships while awaiting evolution.,"{'small': 'https://images.pokemontcg.io/xy2/2.png', 'large': 'https://images.pokemontcg.io/xy2/2_hires.png'}"
hgss1-2,Azumarill,90,['Water'],,"[{'type': 'Lightning', 'value': '×2'}]",,2,Kouki Saitou,Rare Holo,"When it plays in water, it rolls up its elongated ears to prevent their insides from getting wet.","{'small': 'https://images.pokemontcg.io/hgss1/2.png', 'large': 'https://images.pokemontcg.io/hgss1/2_hires.png'}"
det1-2,Ludicolo,140,['Grass'],"[{'name': 'Table Service', 'text': 'Once during your turn (before your attack), you may heal 30 damage from 1 of your Pokémon.', 'type': 'Ability'}]","[{'type': 'Fire', 'value': '×2'}]",,3,Framestore,Rare,"If it hears festive music, all its muscles fill with energy. It can't help breaking out into a dance.","{'small': 'https://images.pokemontcg.io/det1/2.png', 'large': 'https://images.pokemontcg.io/det1/2_hires.png'}"
dp1-1,Dialga,90,['Metal'],,"[{'type': 'Fire', 'value': '+20'}]","[{'type': 'Psychic', 'value': '-20'}]",2,Nakaoka,Rare Holo,It has the power to control time. It appears in Sinnoh-region myths as an ancient deity.,"{'small': 'https://images.pokemontcg.io/dp1/1.png', 'large': 'https://images.pokemontcg.io/dp1/1_hires.png'}"
xy7-1,Oddish,50,['Grass'],,"[{'type': 'Fire', 'value': '×2'}]",,1,MAHOU,Common,"Its scientific name is ""Oddium Wanderus."" At night, it is said to walk nearly 1,000 feet on its two roots.","{'small': 'https://images.pokemontcg.io/xy7/1.png', 'large': 'https://images.pokemontcg.io/xy7/1_hires.png'}"
dv1-2,Dratini,40,['Dragon'],,"[{'type': 'Dragon', 'value': '×2'}]",,1,Naoki Saito,Rare Holo,"It is called the ""Mirage Pokémon"" because so few have seen it. Its shed skin has been found.","{'small': 'https://images.pokemontcg.io/dv1/2.png', 'large': 'https://images.pokemontcg.io/dv1/2_hires.png'}"
ecard2-H3,Ariados,70,['Grass'],"[{'name': 'Gluey Slime', 'text': ""As long as Ariados is in play, each player must pay an additional Colorless to retreat his or her Active Pokémon. Gluey Slime can't make a player pay more than an additional Colorless to retreat a Pokémon, even if there is more than 1 Ariados in play."", 'type': 'Poké-Body'}]","[{'type': 'Fire', 'value': '×2'}]",,,Shin-ichi Yoshida,Rare Holo,,"{'small': 'https://images.pokemontcg.io/ecard2/H3.png', 'large': 'https://images.pokemontcg.io/ecard2/H3_hires.png'}"
sm12-2,Oddish,60,['Grass'],,"[{'type': 'Fire', 'value': '×2'}]",,1,Yumi,Common,"During the day, it stays in the cold underground to avoid the sun. It grows by bathing in moonlight.","{'small': 'https://images.pokemontcg.io/sm12/2.png', 'large': 'https://images.pokemontcg.io/sm12/2_hires.png'}"
base3-3,Ditto,50,['Colorless'],"[{'name': 'Transform', 'text': ""If Ditto is your Active Pokémon, treat it as if it were the same card as the Defending Pokémon, including type, Hit Points, Weakness, and so on, except Ditto can't evolve, always has this Pokémon Power, and you may treat any Energy attached to Ditto as Energy of any type. Ditto isn't a copy of any other Pokémon while Ditto is Asleep, Confused, or Paralyzed."", 'type': 'Pokémon Power'}]","[{'type': 'Fighting', 'value': '×2'}]","[{'type': 'Psychic', 'value': '-30'}]",1,Keiji Kinebuchi,Rare Holo,Capable of copying an enemy's genetic code to instantly transform itself into a duplicate of the enemy.,"{'small': 'https://images.pokemontcg.io/base3/3.png', 'large': 'https://images.pokemontcg.io/base3/3_hires.png'}"
hgss1-3,Clefable,80,['Colorless'],,"[{'type': 'Fighting', 'value': '×2'}]",,1,Masakazu Fukuda,Rare Holo,"With its acute hearing, it can pick up sounds from far away. It usually hides in quiet places.","{'small': 'https://images.pokemontcg.io/hgss1/3.png', 'large': 'https://images.pokemontcg.io/hgss1/3_hires.png'}"
gym1-3,Erika's Clefable,70,['Colorless'],,"[{'type': 'Fighting', 'value': '×2'}]","[{'type': 'Psychic', 'value': '-30'}]",2,Atsuko Nishida,Rare Holo,,"{'small': 'https://images.pokemontcg.io/gym1/3.png', 'large': 'https://images.pokemontcg.io/gym1/3_hires.png'}"
base5-1,Dark Alakazam,60,['Psychic'],,"[{'type': 'Psychic', 'value': '×2'}]",,3,Ken Sugimori,Rare Holo,"Almost as if it were being controlled by something else, it never changes expressions, even in the middle of battle.","{'small': 'https://images.pokemontcg.io/base5/1.png', 'large': 'https://images.pokemontcg.io/base5/1_hires.png'}"
bw11-1,Tangela,70,['Grass'],,"[{'type': 'Fire', 'value': '×2'}]","[{'type': 'Water', 'value': '-20'}]",2,kirisAki,Common,"Many writhing vines cover it, so its true identity remains unknown. The blue vines grow its whole life long.","{'small': 'https://images.pokemontcg.io/bw11/1.png', 'large': 'https://images.pokemontcg.io/bw11/1_hires.png'}"
pop3-1,Blastoise,120,['Water'],,"[{'type': 'Lightning', 'value': '×2'}]",,2,Mitsuhiro Arita,Rare,,"{'small': 'https://images.pokemontcg.io/pop3/1.png', 'large': 'https://images.pokemontcg.io/pop3/1_hires.png'}"
dp4-1,Blaziken,130,['Fire'],,"[{'type': 'Water', 'value': '+30'}]",,1,Kagemaru Himeno,Rare Holo,"Flames spout from its wrists, enveloping its knuckles. Its punches scorch its foes.","{'small': 'https://images.pokemontcg.io/dp4/1.png', 'large': 'https://images.pokemontcg.io/dp4/1_hires.png'}"
bw5-1,Bulbasaur,60,['Grass'],,"[{'type': 'Fire', 'value': '×2'}]","[{'type': 'Water', 'value': '-20'}]",2,Mitsuhiro Arita,Common,"For some time after its birth, it grows by gaining nourishment from the seed on its back.","{'small': 'https://images.pokemontcg.io/bw5/1.png', 'large': 'https://images.pokemontcg.io/bw5/1_hires.png'}"
dpp-DP01,Turtwig,60,['Grass'],,"[{'type': 'Fire', 'value': '+10'}]","[{'type': 'Water', 'value': '-20'}]",2,Masakazu Fukuda,Promo,"Made from soil, the shell on its back hardens when it drinks water. It lives along lakes.","{'small': 'https://images.pokemontcg.io/dpp/DP01.png', 'large': 'https://images.pokemontcg.io/dpp/DP01_hires.png'}"
swsh1-1,Celebi V,180,['Grass'],,"[{'type': 'Fire', 'value': '×2'}]",,1,PLANETA Igarashi,Rare Holo V,,"{'small': 'https://images.pokemontcg.io/swsh1/1.png', 'large': 'https://images.pokemontcg.io/swsh1/1_hires.png'}"
base6-1,Alakazam,80,['Psychic'],"[{'name': 'Damage Swap', 'text': ""As often as you like during your turn (before your attack), you may move 1 damage counter from 1 of your Pokémon to another as long as you don't Knock Out that Pokémon. This power can't be used if Alakazam is affected by a Special Condition."", 'type': 'Pokémon Power'}]","[{'type': 'Psychic', 'value': '×2'}]",,3,Ken Sugimori,Rare Holo,Its brain can outperform a supercomputer. Its intelligence quotient is said to be 5000.,"{'small': 'https://images.pokemontcg.io/base6/1.png', 'large': 'https://images.pokemontcg.io/base6/1_hires.png'}"
pop9-1,Garchomp,130,['Colorless'],,"[{'type': 'Colorless', 'value': '+30'}]",,,Kagemaru Himeno,Rare,It flies at speeds equal to a jet fighter plane. It never allows its prey to escape.,"{'small': 'https://images.pokemontcg.io/pop9/1.png', 'large': 'https://images.pokemontcg.io/pop9/1_hires.png'}"
sm115-3,Butterfree,130,['Grass'],,"[{'type': 'Fire', 'value': '×2'}]",,1,Masakazu Fukuda,Rare,"Its wings are covered in toxic scales. If it finds bird Pokémon going after Caterpie, Butterfree sprinkles its scales on them to drive them off.","{'small': 'https://images.pokemontcg.io/sm115/3.png', 'large': 'https://images.pokemontcg.io/sm115/3_hires.png'}"
det1-4,Charmander,60,['Fire'],,"[{'type': 'Water', 'value': '×2'}]",,1,MPC Film,Common,"The flame on its tail indicates Charmander's life force. If it is healthy, the flame burns brightly.","{'small': 'https://images.pokemontcg.io/det1/4.png', 'large': 'https://images.pokemontcg.io/det1/4_hires.png'}"
pop4-2,Deoxys δ,70,['Colorless'],"[{'name': 'Form Change', 'text': ""Once during your turn (before your attack), you may search your deck for another Deoxys and switch it with Deoxys. (Any cards attached to Deoxys, damage counters, Special Conditions, and effects on it are now on the new Pokémon.) If you do, put Deoxys on top of your deck. Shuffle your deck afterward. You can't use more than 1 Form Change Poké-Power each turn."", 'type': 'Poké-Power'}]","[{'type': 'Psychic', 'value': '×2'}]",,1,Kouki Saitou,Rare,,"{'small': 'https://images.pokemontcg.io/pop4/2.png', 'large': 'https://images.pokemontcg.io/pop4/2_hires.png'}"
ex12-4,Delcatty,80,['Colorless'],"[{'name': 'Reactive Shift', 'text': ""Once during your turn (before your attack), you may move a React Energy card attached to 1 of your Pokémon to another of your Pokémon. This power can't be used if Delcatty is affected by a Special Condition."", 'type': 'Poké-Power'}]","[{'type': 'Fighting', 'value': '×2'}]",,1,Naoyo Kimura,Rare Holo,,"{'small': 'https://images.pokemontcg.io/ex12/4.png', 'large': 'https://images.pokemontcg.io/ex12/4_hires.png'}"
ex3-4,Flygon,120,['Colorless'],,"[{'type': 'Colorless', 'value': '×2'}]","[{'type': 'Fire', 'value': '-30'}, {'type': 'Lightning', 'value': '-30'}]",2,Mitsuhiro Arita,Rare Holo,,"{'small': 'https://images.pokemontcg.io/ex3/4.png', 'large': 'https://images.pokemontcg.io/ex3/4_hires.png'}"
xy2-4,Pineco,60,['Grass'],,"[{'type': 'Fire', 'value': '×2'}]",,2,Suwama Chiaki,Common,It likes to make its shell thicker by adding layers of tree bark. The additional weight doesn't bother it.,"{'small': 'https://images.pokemontcg.io/xy2/4.png', 'large': 'https://images.pokemontcg.io/xy2/4_hires.png'}"
ex11-4,Espeon δ,70,"['Psychic', 'Metal']","[{'name': 'Delta Heal', 'text': ""Once during your turn (before your attack), you may remove 1 damage counter from each of your Pokémon that has δ on its card. You can't use more than 1 Delta Heal Poké-Power each turn. This power can't be used if Espeon is affected by a Special Condition."", 'type': 'Poké-Power'}]","[{'type': 'Psychic', 'value': '×2'}]",,1,Ryo Ueda,Rare Holo,,"{'small': 'https://images.pokemontcg.io/ex11/4.png', 'large': 'https://images.pokemontcg.io/ex11/4_hires.png'}"
gym2-3,Brock's Ninetales,70,['Fire'],"[{'name': 'Shapeshift', 'text': ""Once during your turn (before your attack), you may attach an Evolution card from your hand to Brock's Ninetales. (This doesn't count as evolving Brock's Ninetales.) Treat Brock's Ninetales as if it were that Pokémon instead. It can't evolve, devolve, or use the Pokémon Power of that Pokémon. During your turn, you may discard the Evolution card attached to Brock's Ninetales. This power can't be used if Brock's Ninetales is Asleep, Confused, or Paralyzed. If Brock's Ninetales becomes Asleep, Confused, or Paralyzed, discard all Evolution cards attached to it."", 'type': 'Pokémon Power'}]","[{'type': 'Water', 'value': '×2'}]",,1,Ken Sugimori,Rare Holo,,"{'small': 'https://images.pokemontcg.io/gym2/3.png', 'large': 'https://images.pokemontcg.io/gym2/3_hires.png'}"
pop1-2,Metagross,100,['Metal'],,"[{'type': 'Fire', 'value': '×2'}]","[{'type': 'Grass', 'value': '-30'}]",3,Ken Sugimori,Rare,,"{'small': 'https://images.pokemontcg.io/pop1/2.png', 'large': 'https://images.pokemontcg.io/pop1/2_hires.png'}"
pl4-2,Froslass,80,['Water'],"[{'name': 'Snow Gift', 'text': 'Once during your turn, when you play Froslass from your hand to evolve 1 of your Pokémon, you may search your deck for any 1 card and put it into your hand. Shuffle your deck afterward.', 'type': 'Poké-Power'}]","[{'type': 'Metal', 'value': '+20'}]",,1,TOKIYA,Rare Holo,It freezes prey by blowing its -58 degrees F breath. It is said to then secretly display its prey.,"{'small': 'https://images.pokemontcg.io/pl4/2.png', 'large': 'https://images.pokemontcg.io/pl4/2_hires.png'}"
sm3-2,Metapod,80,['Grass'],,"[{'type': 'Fire', 'value': '×2'}]",,2,Suwama Chiaki,Uncommon,Its shell is filled with its soft innards. It doesn't move much because of the risk it might carelessly spill its innards out.,"{'small': 'https://images.pokemontcg.io/sm3/2.png', 'large': 'https://images.pokemontcg.io/sm3/2_hires.png'}"
bw10-3,Lileep,80,['Grass'],"[{'name': 'Prehistoric Call', 'text': 'Once during your turn (before your attack), if this Pokémon is in your discard pile, you may put this Pokémon on the bottom of your deck.', 'type': 'Ability'}]","[{'type': 'Fire', 'value': '×2'}]","[{'type': 'Water', 'value': '-20'}]",2,Suwama Chiaki,Uncommon,It lived on the seafloor 100 million years ago and was reanimated scientifically.,"{'small': 'https://images.pokemontcg.io/bw10/3.png', 'large': 'https://images.pokemontcg.io/bw10/3_hires.png'}"
hgss4-4,Drapion,100,['Darkness'],,"[{'type': 'Fighting', 'value': '×2'}]","[{'type': 'Psychic', 'value': '-20'}]",3,Sumiyoshi Kizuki,Rare Holo,It attacks people and Pokémon that cross the desert. This has only furthered its bad reputation.,"{'small': 'https://images.pokemontcg.io/hgss4/4.png', 'large': 'https://images.pokemontcg.io/hgss4/4_hires.png'}"
ex13-3,Deoxys δ,70,['Darkness'],"[{'name': 'Form Change', 'text': ""Once during your turn (before your attack), you may search your deck for another Deoxys and switch it with Deoxys. (Any cards attached to Deoxys, damage counters, Special Conditions, and effects on it are now on the new Pokémon.) If you do, put Deoxys on top of your deck. Shuffle your deck afterward. You can't use more than 1 Form Change Poké-Power each turn."", 'type': 'Poké-Power'}]","[{'type': 'Psychic', 'value': '×2'}]",,1,Mitsuhiro Arita,Rare Holo,,"{'small': 'https://images.pokemontcg.io/ex13/3.png', 'large': 'https://images.pokemontcg.io/ex13/3_hires.png'}"
bw6-1,Hoppip,30,['Grass'],,"[{'type': 'Fire', 'value': '×2'}]","[{'type': 'Water', 'value': '-20'}]",1,Kouki Saitou,Common,"It drifts on winds. It is said that when Hoppip gather in fields and mountains, spring is on the way.","{'small': 'https://images.pokemontcg.io/bw6/1.png', 'large': 'https://images.pokemontcg.io/bw6/1_hires.png'}"
xy11-4,Skiploom,70,['Grass'],,"[{'type': 'Fire', 'value': '×2'}]",,1,Eri Yamaki,Uncommon,It spreads its petals to absorb sunlight. It also floats in the air to get closer to the sun.,"{'small': 'https://images.pokemontcg.io/xy11/4.png', 'large': 'https://images.pokemontcg.io/xy11/4_hires.png'}"
hgss4-5,Mamoswine,140,['Water'],,"[{'type': 'Metal', 'value': '×2'}]",,4,Kagemaru Himeno,Rare Holo,"A frozen Mamoswine was dug from ice dating back 10,000 years. This Pokémon has been around a long, long, long time.","{'small': 'https://images.pokemontcg.io/hgss4/5.png', 'large': 'https://images.pokemontcg.io/hgss4/5_hires.png'}"
sm5-3,Yanmega,120,['Grass'],,"[{'type': 'Lightning', 'value': '×2'}]","[{'type': 'Fighting', 'value': '-20'}]",1,SATOSHI NAKAI,Uncommon,This six-legged Pokémon is easily capable of transporting an adult in flight. The wings on its tail help it stay balanced.,"{'small': 'https://images.pokemontcg.io/sm5/3.png', 'large': 'https://images.pokemontcg.io/sm5/3_hires.png'}"
pl3-4,Electivire FB,90,['Lightning'],,"[{'type': 'Fighting', 'value': '×2'}]","[{'type': 'Metal', 'value': '-20'}]",3,Hironobu Yoshida,Rare Holo,,"{'small': 'https://images.pokemontcg.io/pl3/4.png', 'large': 'https://images.pokemontcg.io/pl3/4_hires.png'}"
swsh4-2,Kakuna,80,['Grass'],,"[{'type': 'Fire', 'value': '×2'}]",,3,Naoyo Kimura,Uncommon,"While awaiting evolution, it hides from predators under leaves and in nooks of branches.","{'small': 'https://images.pokemontcg.io/swsh4/2.png', 'large': 'https://images.pokemontcg.io/swsh4/2_hires.png'}"
gym2-4,Erika's Venusaur,90,['Grass'],,"[{'type': 'Fire', 'value': '×2'}]",,2,Ken Sugimori,Rare Holo,,"{'small': 'https://images.pokemontcg.io/gym2/4.png', 'large': 'https://images.pokemontcg.io/gym2/4_hires.png'}"
pop3-3,Jolteon,70,['Lightning'],,"[{'type': 'Fighting', 'value': '×2'}]","[{'type': 'Metal', 'value': '-30'}]",,Masakazu Fukuda,Rare,,"{'small': 'https://images.pokemontcg.io/pop3/3.png', 'large': 'https://images.pokemontcg.io/pop3/3_hires.png'}"
base6-3,Charizard,120,['Fire'],"[{'name': 'Energy Burn', 'text': ""As often as you like during your turn (before your attack), you may turn all Energy attached to Charizard into Fire Energy for the rest of the turn. This power can't be used if Charizard is affected by a Special Condition."", 'type': 'Pokémon Power'}]","[{'type': 'Water', 'value': '×2'}]","[{'type': 'Fighting', 'value': '-30'}]",3,Mitsuhiro Arita,Rare Holo,Spits fire that is hot enough to melt boulders. Known to unintentionally cause forest fires.,"{'small': 'https://images.pokemontcg.io/base6/3.png', 'large': 'https://images.pokemontcg.io/base6/3_hires.png'}"
bw4-3,Kricketot,60,['Grass'],,"[{'type': 'Fire', 'value': '×2'}]",,1,MAHOU,Common,"Its legs are short. Whenever it stumbles, its stiff antennae clack with a xylophone-like sound.","{'small': 'https://images.pokemontcg.io/bw4/3.png', 'large': 'https://images.pokemontcg.io/bw4/3_hires.png'}"
hgss2-2,Magmortar,110,['Fire'],,"[{'type': 'Water', 'value': '×2'}]",,2,Hajime Kusajima,Rare Holo,"It blasts fireballs of over 3,600 degrees Fahrenheit out of its arms. Its breath also sears and sizzles.","{'small': 'https://images.pokemontcg.io/hgss2/2.png', 'large': 'https://images.pokemontcg.io/hgss2/2_hires.png'}"
swsh4-1,Weedle,40,['Grass'],,"[{'type': 'Fire', 'value': '×2'}]",,1,sui,Common,Its poison stinger is very powerful. Its bright-colored body is intended to warn off its enemies.,"{'small': 'https://images.pokemontcg.io/swsh4/1.png', 'large': 'https://images.pokemontcg.io/swsh4/1_hires.png'}"
pop1-1,Blaziken,110,['Fire'],,"[{'type': 'Water', 'value': '×2'}]",,2,Katsura Tabata,Rare,,"{'small': 'https://images.pokemontcg.io/pop1/1.png', 'large': 'https://images.pokemontcg.io/pop1/1_hires.png'}"
bw8-1,Turtwig,70,['Grass'],,"[{'type': 'Fire', 'value': '×2'}]","[{'type': 'Water', 'value': '-20'}]",2,Kouki Saitou,Common,"The shell on its back is made of soil. On a very healthy Turtwig, the shell should feel moist.","{'small': 'https://images.pokemontcg.io/bw8/1.png', 'large': 'https://images.pokemontcg.io/bw8/1_hires.png'}"
neo4-1,Dark Ampharos,70,['Lightning'],"[{'name': 'Conductivity', 'text': ""Whenever your opponent attaches an Energy card from his or her hand to a Pokémon, this power does 10 damage to that Pokémon. (Don't apply Weakness and Resistance.) This power stops working if you have more than 1 Dark Ampharos in play or while Dark Ampharos is Asleep, Confused, or Paralyzed."", 'type': 'Pokémon Power'}]","[{'type': 'Fighting', 'value': '×2'}]",,2,Kagemaru Himeno,Rare Holo,"Its brightly lit tail can be seen for miles in the dark, even by ships on the sea.","{'small': 'https://images.pokemontcg.io/neo4/1.png', 'large': 'https://images.pokemontcg.io/neo4/1_hires.png'}"
pop7-3,Latias,80,['Colorless'],,"[{'type': 'Colorless', 'value': '+20'}]","[{'type': 'Fighting', 'value': '-20'}]",1,Daisuke Ito,Rare,Its body is covered with a down that can refract light in such a way that it becomes invisible.,"{'small': 'https://images.pokemontcg.io/pop7/3.png', 'large': 'https://images.pokemontcg.io/pop7/3_hires.png'}"
hgss1-4,Gyarados,130,['Water'],,"[{'type': 'Lightning', 'value': '×2'}]","[{'type': 'Fighting', 'value': '-20'}]",3,Mitsuhiro Arita,Rare Holo,"Once it appears, it goes on a rampage. It remains enraged until it demolishes everything around it.","{'small': 'https://images.pokemontcg.io/hgss1/4.png', 'large': 'https://images.pokemontcg.io/hgss1/4_hires.png'}"
xy1-2,M Venusaur-EX,230,['Grass'],,"[{'type': 'Fire', 'value': '×2'}]",,4,5ban Graphics,Rare Holo EX,,"{'small': 'https://images.pokemontcg.io/xy1/2.png', 'large': 'https://images.pokemontcg.io/xy1/2_hires.png'}"
ex8-2,Beautifly,100,['Grass'],"[{'name': 'Hunch', 'text': ""As long as Beautifly's remaining HP is 40 or less, Beautifly does 40 more damage to the Defending Pokémon (before applying Weakness and Resistance)."", 'type': 'Poké-Body'}]","[{'type': 'Fire', 'value': '×2'}]",,1,Kagemaru Himeno,Rare Holo,,"{'small': 'https://images.pokemontcg.io/ex8/2.png', 'large': 'https://images.pokemontcg.io/ex8/2_hires.png'}"
dpp-DP02,Chimchar,50,['Fire'],,"[{'type': 'Water', 'value': '+10'}]",,1,Kagemaru Himeno,Promo,It agilely scales sheer cliffs to live atop craggy mountains. Its fire is put out when it sleeps.,"{'small': 'https://images.pokemontcg.io/dpp/DP02.png', 'large': 'https://images.pokemontcg.io/dpp/DP02_hires.png'}"
