id,name,hp,types,abilities,weaknesses,resistances,convertedRetreatCost,artist,rarity,flavorText,images
dp3-1,Ampharos,130,['Lightning'],"[{'name': 'Jamming', 'text': ""After your opponent plays a Supporter card from his or her hand, put 1 damage counter on each of your opponent's Pokémon. You can't use more than 1 Jamming Poké-Body each turn."", 'type': 'Poké-Body'}]","[{'type': 'Fighting', 'value': '+30'}]","[{'type': 'Metal', 'value': '-20'}]",3,Kouki Saitou,Rare Holo,"The tip of its tail shines brightly. In the olden days, people sent signals using the tail's light.","{'small': 'https://images.pokemontcg.io/dp3/1.png', 'large': 'https://images.pokemontcg.io/dp3/1_hires.png'}"
ex12-1,Aerodactyl,70,['Colorless'],"[{'name': 'Reactive Protection', 'text': ""Any damage done to Aerodactyl by attacks from your opponent's Pokémon is reduced by 10 for each React Energy card attached to Aerodactyl (after applying Weakness and Resistance)."", 'type': 'Poké-Body'}]","[{'type': 'Lightning', 'value': '×2'}]","[{'type': 'Fighting', 'value': '-30'}]",,Hajime Kusajima,Rare Holo,,"{'small': 'https://images.pokemontcg.io/ex12/1.png', 'large': 'https://images.pokemontcg.io/ex12/1_hires.png'}"
ex7-1,Azumarill,80,['Water'],"[{'name': 'Froth', 'text': 'Once during your turn, when you play Azumarill from your hand to evolve 1 of your Active Pokémon, you may use this power. Each Defending Pokémon is now Paralyzed.', 'type': 'Poké-Power'}]","[{'type': 'Lightning', 'value': '×2'}]",,1,Sumiyoshi Kizuki,Rare Holo,,"{'small': 'https://images.pokemontcg.io/ex7/1.png', 'large': 'https://images.pokemontcg.io/ex7/1_hires.png'}"
sm9-1,Celebi & Venusaur-GX,270,['Grass'],,"[{'type': 'Fire', 'value': '×2'}]",,4,Mitsuhiro Arita,Rare Holo GX,,"{'small': 'https://images.pokemontcg.io/sm9/1.png', 'large': 'https://images.pokemontcg.io/sm9/1_hires.png'}"
pl1-2,Blastoise,130,['Water'],"[{'name': 'Dig Well', 'text': ""Once during your turn (before your attack), you may look at the top 3 cards of your deck, choose as many Water Energy cards as you like, and attach them to your Pokémon in any way you like. Discard the other cards. This power can't be used if Blastoise is affected by a Special Condition."", 'type': 'Poké-Power'}]","[{'type': 'Lightning', 'value': '+30'}]",,2,Kagemaru Himeno,Rare Holo,,"{'small': 'https://images.pokemontcg.io/pl1/2.png', 'large': 'https://images.pokemontcg.io/pl1/2_hires.png'}"
ex3-2,Altaria,80,['Colorless'],,"[{'type': 'Colorless', 'value': '×2'}]","[{'type': 'Grass', 'value': '-30'}, {'type': 'Fighting', 'value': '-30'}]",1,Atsuko Nishida,Rare Holo,,"{'small': 'https://images.pokemontcg.io/ex3/2.png', 'large': 'https://images.pokemontcg.io/ex3/2_hires.png'}"
sm9-2,Weedle,40,['Grass'],,"[{'type': 'Fire', 'value': '×2'}]",,1,Shibuzoh.,Common,"Often found in forests and grasslands. It has a sharp, toxic barb of around two inches on top of its head.","{'small': 'https://images.pokemontcg.io/sm9/2.png', 'large': 'https://images.pokemontcg.io/sm9/2_hires.png'}"
xy5-2,Kakuna,80,['Grass'],,"[{'type': 'Fire', 'value': '×2'}]",,3,Kagemaru Himeno,Uncommon,"While awaiting evolution, it hides from predators under leaves and in nooks of branches.","{'small': 'https://images.pokemontcg.io/xy5/2.png', 'large': 'https://images.pokemontcg.io/xy5/2_hires.png'}"
sm12-1,Venusaur & Snivy-GX,270,['Grass'],"[{'name': 'Shining Vine', 'text': ""Once during your turn, if this Pokémon is your Active Pokémon, when you attach a Grass Energy card from your hand to it, you may switch 1 of your opponent's Benched Pokémon with their Active Pokémon."", 'type': 'Ability'}]","[{'type': 'Fire', 'value': '×2'}]",,3,Mitsuhiro Arita,Rare Holo GX,,"{'small': 'https://images.pokemontcg.io/sm12/1.png', 'large': 'https://images.pokemontcg.io/sm12/1_hires.png'}"
sm3-1,Caterpie,50,['Grass'],,"[{'type': 'Fire', 'value': '×2'}]",,1,Sekio,Common,"When attacked by bird Pokémon, it resists by releasing a terrifically strong odor from its antennae, but it often becomes their prey.","{'small': 'https://images.pokemontcg.io/sm3/1.png', 'large': 'https://images.pokemontcg.io/sm3/1_hires.png'}"
pop7-1,Ampharos,130,['Lightning'],"[{'name': 'Jamming', 'text': ""After your opponent plays a Supporter card from his or her hand, put 1 damage counter on each of your opponent's Pokémon. You can't use more than 1 Jamming Poké-Body each turn."", 'type': 'Poké-Body'}]","[{'type': 'Fighting', 'value': '+30'}]","[{'type': 'Metal', 'value': '-20'}]",3,Kouki Saitou,Rare,"The tip of its tail shines brightly. In the olden days, people sent signals using the tail's light.","{'small': 'https://images.pokemontcg.io/pop7/1.png', 'large': 'https://images.pokemontcg.io/pop7/1_hires.png'}"
bw1-2,Snivy,60,['Grass'],,"[{'type': 'Fire', 'value': '×2'}]","[{'type': 'Water', 'value': '-20'}]",1,5ban Graphics,Common,"They photosynthesize by bathing their tails in sunlight. When they are not feeling well, their tails droop.","{'small': 'https://images.pokemontcg.io/bw1/2.png', 'large': 'https://images.pokemontcg.io/bw1/2_hires.png'}"
base4-3,Chansey,120,['Colorless'],,"[{'type': 'Fighting', 'value': '×2'}]","[{'type': 'Psychic', 'value': '-30'}]",1,Ken Sugimori,Rare Holo,A rare and elusive Pokémon that is said to bring happiness to those who manage to catch it.,"{'small': 'https://images.pokemontcg.io/base4/3.png', 'large': 'https://images.pokemontcg.io/base4/3_hires.png'}"
hgss4-3,Celebi,70,['Psychic'],,"[{'type': 'Psychic', 'value': '×2'}]",,1,Shin Nagasawa,Rare Holo,This Pokémon wanders across time. Grass and trees flourish in the forests in which it has appeared.,"{'small': 'https://images.pokemontcg.io/hgss4/3.png', 'large': 'https://images.pokemontcg.io/hgss4/3_hires.png'}"
ex7-3,Dark Crobat,90,['Grass'],"[{'name': 'Black Beam', 'text': ""Once during your turn (before your attack), if Dark Crobat is your Active Pokémon, you may choose 1 of the Defending Pokémon. That Pokémon is now Poisoned. This power can't be used if Dark Crobat is affected by a Special Condition."", 'type': 'Poké-Power'}]","[{'type': 'Lightning', 'value': '×2'}]","[{'type': 'Fighting', 'value': '-30'}]",1,Kyoko Koizumi,Rare Holo,,"{'small': 'https://images.pokemontcg.io/ex7/3.png', 'large': 'https://images.pokemontcg.io/ex7/3_hires.png'}"
swsh35-2,Weedle,60,['Grass'],,"[{'type': 'Fire', 'value': '×2'}]",,1,Yuka Morii,Common,Its poison stinger is very powerful. Its bright-colored body is intended to warn off its enemies.,"{'small': 'https://images.pokemontcg.io/swsh35/2.png', 'large': 'https://images.pokemontcg.io/swsh35/2_hires.png'}"
xy2-3,Butterfree,130,['Grass'],,"[{'type': 'Lightning', 'value': '×2'}]","[{'type': 'Fighting', 'value': '-20'}]",1,sui,Rare,It loves the honey of flowers and can locate flower patches that have even tiny amounts of pollen.,"{'small': 'https://images.pokemontcg.io/xy2/3.png', 'large': 'https://images.pokemontcg.io/xy2/3_hires.png'}"
sm9-3,Weedle,50,['Grass'],,"[{'type': 'Fire', 'value': '×2'}]",,1,SATOSHI NAKAI,Common,"Often found in forests and grasslands. It has a sharp, toxic barb of around two inches on top of its head.","{'small': 'https://images.pokemontcg.io/sm9/3.png', 'large': 'https://images.pokemontcg.io/sm9/3_hires.png'}"
sm1-2,Metapod,80,['Grass'],,"[{'type': 'Fire', 'value': '×2'}]",,3,Yuka Morii,Uncommon,Its shell is filled with its soft innards. It doesn't move much because of the risk it might carelessly spill its innards out.,"{'small': 'https://images.pokemontcg.io/sm1/2.png', 'large': 'https://images.pokemontcg.io/sm1/2_hires.png'}"
dp3-3,Charizard,130,['Fire'],"[{'name': 'Fury Blaze', 'text': ""If your opponent has 3 or less Prize cards left, each of Charizard's attacks does 50 more damage to the Active Pokémon (before applying Weakness and Resistance)."", 'type': 'Poké-Body'}]","[{'type': 'Water', 'value': '+40'}]","[{'type': 'Fighting', 'value': '-20'}]",3,Daisuke Ito,Rare Holo,It is said that CHARIZARD's fire burns hotter if it has experienced harsh battles.,"{'small': 'https://images.pokemontcg.io/dp3/3.png', 'large': 'https://images.pokemontcg.io/dp3/3_hires.png'}"
base1-1,Alakazam,80,['Psychic'],"[{'name': 'Damage Swap', 'text': ""As often as you like during your turn (before your attack), you may move 1 damage counter from 1 of your Pokémon to another as long as you don't Knock Out that Pokémon. This power can't be used if Alakazam is Asleep, Confused, or Paralyzed."", 'type': 'Pokémon Power'}]","[{'type': 'Psychic', 'value': '×2'}]",,3,Ken Sugimori,Rare Holo,Its brain can outperform a supercomputer. Its intelligence quotient is said to be 5000.,"{'small': 'https://images.pokemontcg.io/base1/1.png', 'large': 'https://images.pokemontcg.io/base1/1_hires.png'}"
ex8-1,Altaria,70,['Colorless'],"[{'name': 'Safeguard', 'text': ""Prevent all effects of attacks, including damage, done to Altaria by your opponent's Pokémon-ex."", 'type': 'Poké-Body'}]","[{'type': 'Lightning', 'value': '×2'}]","[{'type': 'Fighting', 'value': '-30'}]",1,Kyoko Umemoto,Rare Holo,,"{'small': 'https://images.pokemontcg.io/ex8/1.png', 'large': 'https://images.pokemontcg.io/ex8/1_hires.png'}"
pop5-1,Ho-Oh,80,['Fire'],,"[{'type': 'Water', 'value': '×2'}]",,2,Mitsuhiro Arita,Rare,,"{'small': 'https://images.pokemontcg.io/pop5/1.png', 'large': 'https://images.pokemontcg.io/pop5/1_hires.png'}"
xy10-1,Shuckle,80,['Grass'],,"[{'type': 'Fire', 'value': '×2'}]",,1,sui,Uncommon,"It stores Berries inside its shell. To avoid attacks, it hides beneath rocks and remains completely still.","{'small': 'https://images.pokemontcg.io/xy10/1.png', 'large': 'https://images.pokemontcg.io/xy10/1_hires.png'}"
ecard2-H1,Ampharos,100,['Lightning'],,"[{'type': 'Fighting', 'value': '×2'}]",,2,Shin-ichi Yoshida,Rare Holo,,"{'small': 'https://images.pokemontcg.io/ecard2/H1.png', 'large': 'https://images.pokemontcg.io/ecard2/H1_hires.png'}"
base4-1,Alakazam,80,['Psychic'],"[{'name': 'Damage Swap', 'text': ""As often as you like during your turn (before your attack), you may move 1 damage counter from 1 of your Pokémon to another as long as you don't Knock Out that Pokémon. This power can't be used if Alakazam is Asleep, Confused, or Paralyzed."", 'type': 'Pokémon Power'}]","[{'type': 'Psychic', 'value': '×2'}]",,3,Ken Sugimori,Rare Holo,Its brain can outperform a supercomputer. Its intelligence quotient is said to be 5000.,"{'small': 'https://images.pokemontcg.io/base4/1.png', 'large': 'https://images.pokemontcg.io/base4/1_hires.png'}"
ex11-1,Beedrill δ,90,"['Grass', 'Metal']","[{'name': 'Final Sting', 'text': ""Once during your turn (before your attack), you may Knock Out Beedrill. If you do, choose 1 of your opponent's Defending Pokémon. That Pokémon is now Paralyzed and Poisoned. Put 2 damage counters instead of 1 on that Pokémon between turns. This power can't be used if Beedrill is affected by a Special Condition."", 'type': 'Poké-Power'}]","[{'type': 'Fire', 'value': '×2'}]",,,Masakazu Fukuda,Rare Holo,,"{'small': 'https://images.pokemontcg.io/ex11/1.png', 'large': 'https://images.pokemontcg.io/ex11/1_hires.png'}"
gym1-2,Brock's Rhydon,80,['Fighting'],"[{'name': 'Bench Guard', 'text': ""As long as Brock's Rhydon is Benched, whenever 1 of your Benched Pokémon is damaged, you may do 10 of that damage to Brock's Rhydon instead. (If more than 1 of your Benched Pokémon is damaged at the same time, you may use this power once for each of them.)"", 'type': 'Pokémon Power'}]","[{'type': 'Grass', 'value': '×2'}]","[{'type': 'Lightning', 'value': '-30'}]",3,Ken Sugimori,Rare Holo,,"{'small': 'https://images.pokemontcg.io/gym1/2.png', 'large': 'https://images.pokemontcg.io/gym1/2_hires.png'}"
ex14-1,Banette,70,['Psychic'],"[{'name': 'Safeguard', 'text': ""Prevent all effects of attacks, including damage, done to Banette by your opponent's Pokémon-ex."", 'type': 'Poké-Body'}]","[{'type': 'Darkness', 'value': '×2'}]","[{'type': 'Fighting', 'value': '-30'}]",1,Kyoko Umemoto,Rare Holo,,"{'small': 'https://images.pokemontcg.io/ex14/1.png', 'large': 'https://images.pokemontcg.io/ex14/1_hires.png'}"
sm115-1,Caterpie,60,['Grass'],,"[{'type': 'Fire', 'value': '×2'}]",,1,tetsuya koizumi,Common,"Perhaps because it would like to grow up quickly, it has a voracious appetite, eating a hundred leaves a day.","{'small': 'https://images.pokemontcg.io/sm115/1.png', 'large': 'https://images.pokemontcg.io/sm115/1_hires.png'}"
col1-1,Clefable,80,['Colorless'],,"[{'type': 'Fighting', 'value': '×2'}]",,1,sui,Rare Holo,"With its acute hearing, it can pick up sounds from far away. It usually hides in quiet places.","{'small': 'https://images.pokemontcg.io/col1/1.png', 'large': 'https://images.pokemontcg.io/col1/1_hires.png'}"
ex9-1,Blaziken,110,['Fire'],"[{'name': 'Blaze', 'text': ""As long as Blaziken's remaining HP is 40 or less, Blaziken does 40 more damage to the Defending Pokémon (before applying Weakness and Resistance)."", 'type': 'Poké-Body'}]","[{'type': 'Water', 'value': '×2'}]",,2,Midori Harada,Rare Holo,,"{'small': 'https://images.pokemontcg.io/ex9/1.png', 'large': 'https://images.pokemontcg.io/ex9/1_hires.png'}"
bw10-1,Surskit,50,['Grass'],,"[{'type': 'Fire', 'value': '×2'}]",,1,Naoyo Kimura,Common,It appears as if it is skating on water. It draws prey with a sweet scent from the tip of its head.,"{'small': 'https://images.pokemontcg.io/bw10/1.png', 'large': 'https://images.pokemontcg.io/bw10/1_hires.png'}"
ex9-2,Deoxys,70,['Psychic'],"[{'name': 'Form Change', 'text': ""Once during your turn (before your attack), you may search your deck for another Deoxys and switch it with Deoxys. (Any cards attached to Deoxys, damage counters, Special Conditions, and effects on it are now on the new Pokémon.) If you do, put Deoxys on top of your deck. Shuffle your deck afterward. You can't use more than 1 Form Change Poké-Power each turn."", 'type': 'Poké-Power'}]","[{'type': 'Psychic', 'value': '×2'}]",,1,Hironobu Yoshida,Rare Holo,,"{'small': 'https://images.pokemontcg.io/ex9/2.png', 'large': 'https://images.pokemontcg.io/ex9/2_hires.png'}"
xy5-3,Beedrill,120,['Grass'],,"[{'type': 'Fire', 'value': '×2'}]",,,Kouki Saitou,Rare,"May appear in a swarm. Flies at violent speeds, all the while stabbing with the toxic stinger on its rear.","{'small': 'https://images.pokemontcg.io/xy5/3.png', 'large': 'https://images.pokemontcg.io/xy5/3_hires.png'}"
pl3-3,Drifblim FB,80,['Psychic'],"[{'name': 'Pump Up', 'text': 'If your opponent has 3 or less Prize cards left, Drifblim FB gets +40 HP.', 'type': 'Poké-Body'}]","[{'type': 'Darkness', 'value': '×2'}]","[{'type': 'Colorless', 'value': '-20'}]",2,Lee HyunJung,Rare Holo,,"{'small': 'https://images.pokemontcg.io/pl3/3.png', 'large': 'https://images.pokemontcg.io/pl3/3_hires.png'}"
xy7-2,Gloom,80,['Grass'],,"[{'type': 'Fire', 'value': '×2'}]",,1,Masakazu Fukuda,Uncommon,"The honey it drools from its mouth smells so atrocious, it can curl noses more than a mile away.","{'small': 'https://images.pokemontcg.io/xy7/2.png', 'large': 'https://images.pokemontcg.io/xy7/2_hires.png'}"
bw10-2,Masquerain,80,['Grass'],"[{'name': 'Tool Reversal', 'text': 'As often as you like during your turn (before your attack), you may put a Pokémon Tool card attached to 1 of your Pokémon into your hand.', 'type': 'Ability'}]","[{'type': 'Fire', 'value': '×2'}]",,1,5ban Graphics,Rare,Its antennae have eye patterns on them. Its four wings enable it to hover and fly in any direction.,"{'small': 'https://images.pokemontcg.io/bw10/2.png', 'large': 'https://images.pokemontcg.io/bw10/2_hires.png'}"
ex12-3,Cradily,100,['Grass'],,"[{'type': 'Fire', 'value': '×2'}]",,2,Hajime Kusajima,Rare Holo,,"{'small': 'https://images.pokemontcg.io/ex12/3.png', 'large': 'https://images.pokemontcg.io/ex12/3_hires.png'}"
xy11-2,Tangrowth,130,['Grass'],,"[{'type': 'Fire', 'value': '×2'}]",,4,kirisAki,Uncommon,"Its vines grow so profusely that, in the warm season, you can't even see its eyes.","{'small': 'https://images.pokemontcg.io/xy11/2.png', 'large': 'https://images.pokemontcg.io/xy11/2_hires.png'}"
ex3-3,Crawdaunt,80,['Water'],"[{'name': 'Power Pinchers', 'text': 'As long as Crawdaunt is your Active Pokémon, when any of your Active Pokémon does damage to the Defending Pokémon, the attack does 10 more damage (before applying Weakness and Resistance).', 'type': 'Poké-Body'}]","[{'type': 'Lightning', 'value': '×2'}]",,2,Hisao Nakamura,Rare Holo,,"{'small': 'https://images.pokemontcg.io/ex3/3.png', 'large': 'https://images.pokemontcg.io/ex3/3_hires.png'}"
dv1-3,Dragonair,70,['Dragon'],,"[{'type': 'Dragon', 'value': '×2'}]",,2,Hajime Kusajima,Rare Holo,"If its body takes on an aura, the weather changes instantly. It is said to live in seas and lakes.","{'small': 'https://images.pokemontcg.io/dv1/3.png', 'large': 'https://images.pokemontcg.io/dv1/3_hires.png'}"
xy4-1,Venonat,60,['Grass'],,"[{'type': 'Fire', 'value': '×2'}]",,1,Sumiyoshi Kizuki,Common,"Its big eyes are actually clusters of tiny eyes. At night, its kind is drawn by light.","{'small': 'https://images.pokemontcg.io/xy4/1.png', 'large': 'https://images.pokemontcg.io/xy4/1_hires.png'}"
bw4-1,Pinsir,80,['Grass'],,"[{'type': 'Fire', 'value': '×2'}]",,2,Masakazu Fukuda,Rare,"It grips prey with its pincers until the prey is torn in half. What it can't tear, it tosses far.","{'small': 'https://images.pokemontcg.io/bw4/1.png', 'large': 'https://images.pokemontcg.io/bw4/1_hires.png'}"
bw7-1,Oddish,50,['Grass'],,"[{'type': 'Fire', 'value': '×2'}]","[{'type': 'Water', 'value': '-20'}]",1,Kanako Eo,Common,It often plants its root feet in the ground during the day and sows seeds as it walks about at night.,"{'small': 'https://images.pokemontcg.io/bw7/1.png', 'large': 'https://images.pokemontcg.io/bw7/1_hires.png'}"
sm5-1,Exeggcute,50,['Grass'],,"[{'type': 'Fire', 'value': '×2'}]",,1,kawayoo,Common,Its six eggs use telepathy to communicate among themselves. It is believed to carry plant genes and the genes of other species.,"{'small': 'https://images.pokemontcg.io/sm5/1.png', 'large': 'https://images.pokemontcg.io/sm5/1_hires.png'}"
sm8-1,Tangela,80,['Grass'],,"[{'type': 'Fire', 'value': '×2'}]",,2,Ken Sugimori,Common,It tangles any moving thing with its vines. Their subtle shaking is ticklish if you get ensnared.,"{'small': 'https://images.pokemontcg.io/sm8/1.png', 'large': 'https://images.pokemontcg.io/sm8/1_hires.png'}"
hgss4-1,Aggron,140,['Metal'],,"[{'type': 'Fire', 'value': '×2'}]","[{'type': 'Psychic', 'value': '-20'}]",4,Kagemaru Himeno,Rare Holo,You can tell its age by the length of its iron horns. It claims an entire mountain as its territory.,"{'small': 'https://images.pokemontcg.io/hgss4/1.png', 'large': 'https://images.pokemontcg.io/hgss4/1_hires.png'}"
xy5-1,Weedle,50,['Grass'],,"[{'type': 'Fire', 'value': '×2'}]",,1,Midori Harada,Common,Its poison stinger is very powerful. Its bright-colored body is intended to warn off its enemies.,"{'small': 'https://images.pokemontcg.io/xy5/1.png', 'large': 'https://images.pokemontcg.io/xy5/1_hires.png'}"
pl1-1,Ampharos,130,['Lightning'],"[{'name': 'Damage Bind', 'text': ""Each Pokémon that has any damage counters on it (both yours and your opponent's) can't use any Poké-Powers."", 'type': 'Poké-Body'}]","[{'type': 'Fighting', 'value': '+30'}]","[{'type': 'Metal', 'value': '-20'}]",2,Atsuko Nishida,Rare Holo,,"{'small': 'https://images.pokemontcg.io/pl1/1.png', 'large': 'https://images.pokemontcg.io/pl1/1_hires.png'}"
det1-1,Bulbasaur,60,['Grass'],,"[{'type': 'Fire', 'value': '×2'}]",,1,MPC Film,Common,A strange seed was planted on its back at birth. The plant sprouts and grows with this Pokémon.,"{'small': 'https://images.pokemontcg.io/det1/1.png', 'large': 'https://images.pokemontcg.io/det1/1_hires.png'}"
dv1-1,Dratini,40,['Dragon'],,"[{'type': 'Dragon', 'value': '×2'}]",,1,Masakazu Fukuda,Rare Holo,"It is called the ""Mirage Pokémon"" because so few have seen it. Its shed skin has been found.","{'small': 'https://images.pokemontcg.io/dv1/1.png', 'large': 'https://images.pokemontcg.io/dv1/1_hires.png'}"
pl3-1,Absol G,70,['Darkness'],,"[{'type': 'Fighting', 'value': '×2'}]","[{'type': 'Psychic', 'value': '-20'}]",1,Yusuke Ishikawa,Rare Holo,,"{'small': 'https://images.pokemontcg.io/pl3/1.png', 'large': 'https://images.pokemontcg.io/pl3/1_hires.png'}"
xy2-1,Caterpie,40,['Grass'],"[{'name': 'Adaptive Evolution', 'text': 'This Pokémon can evolve during your first turn or the turn you play it.', 'type': 'Ability'}]","[{'type': 'Fire', 'value': '×2'}]",,1,Sumiyoshi Kizuki,Common,"For protection, it releases a horrible stench from the antennae on its head to drive away enemies.","{'small': 'https://images.pokemontcg.io/xy2/1.png', 'large': 'https://images.pokemontcg.io/xy2/1_hires.png'}"
pop6-1,Bastiodon,130,['Metal'],"[{'name': 'Protective Wall', 'text': ""Prevent all damage done to your Benched Pokémon by your opponent's attacks."", 'type': 'Poké-Body'}]","[{'type': 'Fire', 'value': '+40'}]","[{'type': 'Psychic', 'value': '-20'}]",3,Kazuyuki Kano,Rare,Any frontal attack is repulsed. It is a docile Pokémon that feeds on grass and berries.,"{'small': 'https://images.pokemontcg.io/pop6/1.png', 'large': 'https://images.pokemontcg.io/pop6/1_hires.png'}"
ecard2-H2,Arcanine,90,['Fire'],"[{'name': 'Extreme Speed', 'text': 'You pay Colorless less to retreat Arcanine for each Energy attached to it.', 'type': 'Poké-Body'}]","[{'type': 'Water', 'value': '×2'}]",,3,Kyoko Umemoto,Rare Holo,,"{'small': 'https://images.pokemontcg.io/ecard2/H2.png', 'large': 'https://images.pokemontcg.io/ecard2/H2_hires.png'}"
hgss4-2,Altaria,90,['Colorless'],,"[{'type': 'Colorless', 'value': '×2'}]","[{'type': 'Fighting', 'value': '-20'}]",,Ryo Ueda,Rare Holo,It flies gracefully through the sky. Its melodic humming makes you feel like you're in a dream.,"{'small': 'https://images.pokemontcg.io/hgss4/2.png', 'large': 'https://images.pokemontcg.io/hgss4/2_hires.png'}"
pl3-2,Blaziken FB,80,['Fire'],,"[{'type': 'Water', 'value': '×2'}]",,1,Motofumi Fujiwara,Rare Holo,,"{'small': 'https://images.pokemontcg.io/pl3/2.png', 'large': 'https://images.pokemontcg.io/pl3/2_hires.png'}"
ex11-2,Crobat δ,90,"['Grass', 'Metal']",,"[{'type': 'Psychic', 'value': '×2'}]",,,Ryo Ueda,Rare Holo,,"{'small': 'https://images.pokemontcg.io/ex11/2.png', 'large': 'https://images.pokemontcg.io/ex11/2_hires.png'}"
pop6-2,Lucario,90,['Fighting'],,"[{'type': 'Psychic', 'value': '+20'}]",,1,Kouki Saitou,Rare,It has the ability to sense the auras of all things. It understands human speech.,"{'small': 'https://images.pokemontcg.io/pop6/2.png', 'large': 'https://images.pokemontcg.io/pop6/2_hires.png'}"
base4-2,Blastoise,100,['Water'],"[{'name': 'Rain Dance', 'text': ""As often as you like during your turn (before your attack), you may attach 1 Water Energy card to 1 of your Water Pokémon. (This doesn't use up your 1 Energy card attachment for the turn.) This power can't be used if Blastoise is Asleep, Confused, or Paralyzed."", 'type': 'Pokémon Power'}]","[{'type': 'Lightning', 'value': '×2'}]",,3,Ken Sugimori,Rare Holo,A brutal Pokémon with pressurized water jets on its shell. They are used for high-speed tackles.,"{'small': 'https://images.pokemontcg.io/base4/2.png', 'large': 'https://images.pokemontcg.io/base4/2_hires.png'}"
ex12-2,Aggron,110,['Metal'],,"[{'type': 'Fire', 'value': '×2'}]","[{'type': 'Grass', 'value': '-30'}]",4,Hisao Nakamura,Rare Holo,,"{'small': 'https://images.pokemontcg.io/ex12/2.png', 'large': 'https://images.pokemontcg.io/ex12/2_hires.png'}"
ex7-2,Dark Ampharos,120,"['Lightning', 'Darkness']","[{'name': 'Darkest Impulse', 'text': ""As long as Dark Ampharos is in play, whenever your opponent plays an Evolution card from his or her hand to evolve 1 of his or her Pokémon, put 2 damage counters on that Pokémon. You can't use more than 1 Darkest Impulse Poké-Body each turn."", 'type': 'Poké-Body'}]","[{'type': 'Fighting', 'value': '×2'}]",,2,Emi Miwa,Rare Holo,,"{'small': 'https://images.pokemontcg.io/ex7/2.png', 'large': 'https://images.pokemontcg.io/ex7/2_hires.png'}"
xy11-1,Tangela,80,['Grass'],,"[{'type': 'Fire', 'value': '×2'}]",,3,OOYAMA,Common,It tangles any moving thing with its vines. Their subtle shaking is ticklish if you get ensnared.,"{'small': 'https://images.pokemontcg.io/xy11/1.png', 'large': 'https://images.pokemontcg.io/xy11/1_hires.png'}"
bw1-1,Snivy,60,['Grass'],,"[{'type': 'Fire', 'value': '×2'}]","[{'type': 'Water', 'value': '-20'}]",1,Kagemaru Himeno,Common,"They photosynthesize by bathing their tails in sunlight. When they are not feeling well, their tails droop.","{'small': 'https://images.pokemontcg.io/bw1/1.png', 'large': 'https://images.pokemontcg.io/bw1/1_hires.png'}"
gym2-1,Blaine's Arcanine,90,['Fire'],,"[{'type': 'Water', 'value': '×2'}]",,3,Ken Sugimori,Rare Holo,,"{'small': 'https://images.pokemontcg.io/gym2/1.png', 'large': 'https://images.pokemontcg.io/gym2/1_hires.png'}"
swsh35-1,Venusaur V,220,['Grass'],,"[{'type': 'Fire', 'value': '×2'}]",,3,PLANETA Mochizuki,Rare Holo V,,"{'small': 'https://images.pokemontcg.io/swsh35/1.png', 'large': 'https://images.pokemontcg.io/swsh35/1_hires.png'}"
sm1-1,Caterpie,50,['Grass'],,"[{'type': 'Fire', 'value': '×2'}]",,1,Kanako Eo,Common,"When attacked by bird Pokémon, it resists by releasing a terrifically strong odor from its antennae, but it often becomes their prey.","{'small': 'https://images.pokemontcg.io/sm1/1.png', 'large': 'https://images.pokemontcg.io/sm1/1_hires.png'}"
ex13-1,Armaldo δ,110,"['Fighting', 'Metal']",,"[{'type': 'Grass', 'value': '×2'}]",,3,Masakazu Fukuda,Rare Holo,,"{'small': 'https://images.pokemontcg.io/ex13/1.png', 'large': 'https://images.pokemontcg.io/ex13/1_hires.png'}"
pop6-3,Manaphy,70,['Water'],,"[{'type': 'Lightning', 'value': '+20'}]",,1,Atsuko Nishida,Rare,"Born on a cold seafloor, it will swim great distances to return to its birthplace.","{'small': 'https://images.pokemontcg.io/pop6/3.png', 'large': 'https://images.pokemontcg.io/pop6/3_hires.png'}"
