id,name,hp,types,abilities,weaknesses,resistances,convertedRetreatCost,artist,rarity,flavorText,images
col1-3,Dialga,100,['Metal'],,"[{'type': 'Fire', 'value': '×2'}]","[{'type': 'Psychic', 'value': '-20'}]",3,Ayaka Yoshida,Rare Holo,This Pokémon completely controls the flow of time. It uses its power to travel at will through the past and future.,"{'small': 'https://images.pokemontcg.io/col1/3.png', 'large': 'https://images.pokemontcg.io/col1/3_hires.png'}"
bw11-2,Tangrowth,120,['Grass'],,"[{'type': 'Fire', 'value': '×2'}]","[{'type': 'Water', 'value': '-20'}]",4,Kagemaru Himeno,Rare,"Even if one of its arms is eaten, it's fine. The Pokémon regenerates quickly and will go right back to normal.","{'small': 'https://images.pokemontcg.io/bw11/2.png', 'large': 'https://images.pokemontcg.io/bw11/2_hires.png'}"
ecard2-H4,Azumarill,70,['Water'],"[{'name': 'Bubble Turn', 'text': 'Once during your turn (before your attack), if Azumarill is on your Bench, you may flip a coin. If heads, return Azumarill and all cards attached to it to your hand.', 'type': 'Poké-Power'}]","[{'type': 'Lightning', 'value': '×2'}]",,1,Kagemaru Himeno,Rare Holo,,"{'small': 'https://images.pokemontcg.io/ecard2/H4.png', 'large': 'https://images.pokemontcg.io/ecard2/H4_hires.png'}"
neo4-2,Dark Crobat,70,['Grass'],"[{'name': 'Surprise Bite', 'text': ""When you play Dark Crobat from your hand, you may choose 1 of your opponent's Pokémon. This power does 20 damage to that Pokémon. (Don't apply Weakness and Resistance.)"", 'type': 'Pokémon Power'}]","[{'type': 'Psychic', 'value': '×2'}]","[{'type': 'Fighting', 'value': '-30'}]",,"Shin-ichi Yoshikawa, CR CG gangs",Rare Holo,"Although the wings it has evolved on its feet allow it to fly at high speeds, they unfortunately make it difficult to perch.","{'small': 'https://images.pokemontcg.io/neo4/2.png', 'large': 'https://images.pokemontcg.io/neo4/2_hires.png'}"
si1-3,Onix,90,['Fighting'],,"[{'type': 'Grass', 'value': '×2'}]",,3,Keiko Fukuyama,Common,"This Pokémon burrows through the earth at high speed, looking for food. The tunnels it digs are used by Diglett as nests.","{'small': 'https://images.pokemontcg.io/si1/3.png', 'large': 'https://images.pokemontcg.io/si1/3_hires.png'}"
base4-4,Charizard,120,['Fire'],"[{'name': 'Energy Burn', 'text': ""As often as you like during your turn (before your attack), you may turn all Energy attached to Charizard into Fire Energy for the rest of the turn. This power can't be used if Charizard is Asleep, Confused, or Paralyzed."", 'type': 'Pokémon Power'}]","[{'type': 'Water', 'value': '×2'}]","[{'type': 'Fighting', 'value': '-30'}]",3,Mitsuhiro Arita,Rare Holo,Spits fire that is hot enough to melt boulders. Known to unintentionally cause forest fires.,"{'small': 'https://images.pokemontcg.io/base4/4.png', 'large': 'https://images.pokemontcg.io/base4/4_hires.png'}"
bw8-2,Grotle,100,['Grass'],,"[{'type': 'Fire', 'value': '×2'}]","[{'type': 'Water', 'value': '-20'}]",3,Sumiyoshi Kizuki,Uncommon,It knows where pure water wells up. It carries fellow Pokémon there on its back.,"{'small': 'https://images.pokemontcg.io/bw8/2.png', 'large': 'https://images.pokemontcg.io/bw8/2_hires.png'}"
xy7-3,Vileplume,130,['Grass'],"[{'name': 'Irritating Pollen', 'text': ""Each player can't play any Item cards from his or her hand."", 'type': 'Ability'}]","[{'type': 'Fire', 'value': '×2'}]",,3,Midori Harada,Rare,"It has the world's largest petals. With every step, the petals shake out heavy clouds of toxic pollen.","{'small': 'https://images.pokemontcg.io/xy7/3.png', 'large': 'https://images.pokemontcg.io/xy7/3_hires.png'}"
sm75-1,Charmander,70,['Fire'],,"[{'type': 'Water', 'value': '×2'}]",,2,tetsuya koizumi,Common,"From the time it is born, a flame burns at the tip of its tail. Its life would end if the flame were to go out.","{'small': 'https://images.pokemontcg.io/sm75/1.png', 'large': 'https://images.pokemontcg.io/sm75/1_hires.png'}"
ex7-4,Dark Electrode,70,"['Lightning', 'Darkness']","[{'name': 'Darkness Navigation', 'text': ""Once during your turn (before your attack), if Dark Electrode has no Energy attached to it, you may search your deck for a Darkness or Dark Metal Energy and attach it to Dark Electrode. Shuffle your deck afterward. This power can't be used if Dark Electrode is affected by a Special Condition."", 'type': 'Poké-Power'}]","[{'type': 'Fighting', 'value': '×2'}]",,1,Kouki Saitou,Rare Holo,,"{'small': 'https://images.pokemontcg.io/ex7/4.png', 'large': 'https://images.pokemontcg.io/ex7/4_hires.png'}"
swsh1-3,Roselia,70,['Grass'],,"[{'type': 'Fire', 'value': '×2'}]",,1,Naoyo Kimura,Common,"Its flowers give off a relaxing fragrance. The stronger its aroma, the healthier the Roselia is.","{'small': 'https://images.pokemontcg.io/swsh1/3.png', 'large': 'https://images.pokemontcg.io/swsh1/3_hires.png'}"
xy5-4,Tangela,80,['Grass'],,"[{'type': 'Fire', 'value': '×2'}]",,2,match,Common,It tangles any moving thing with its vines. Their subtle shaking is ticklish if you get ensnared.,"{'small': 'https://images.pokemontcg.io/xy5/4.png', 'large': 'https://images.pokemontcg.io/xy5/4_hires.png'}"
ex11-5,Flareon δ,70,"['Fire', 'Metal']",,"[{'type': 'Water', 'value': '×2'}]",,1,Kouki Saitou,Rare Holo,,"{'small': 'https://images.pokemontcg.io/ex11/5.png', 'large': 'https://images.pokemontcg.io/ex11/5_hires.png'}"
ex10-2,Ariados,70,['Grass'],,"[{'type': 'Psychic', 'value': '×2'}]",,1,Mitsuhiro Arita,Rare Holo,,"{'small': 'https://images.pokemontcg.io/ex10/2.png', 'large': 'https://images.pokemontcg.io/ex10/2_hires.png'}"
xy7-4,Bellossom,120,['Grass'],,"[{'type': 'Fire', 'value': '×2'}]",,1,Mizue,Uncommon,"When the heavy rainfall season ends, it is drawn out by warm sunlight to dance in the open.","{'small': 'https://images.pokemontcg.io/xy7/4.png', 'large': 'https://images.pokemontcg.io/xy7/4_hires.png'}"
pl1-5,Dialga,100,['Metal'],"[{'name': 'Reverse Time', 'text': 'Once during your turn, when you put Dialga from your hand onto your Bench, you may search your discard pile for up to 3 in any combination of Pokémon (excluding Pokémon LV.X) and basic Energy cards. Show them to your opponent and put them on top of your deck in any order.', 'type': 'Poké-Power'}]","[{'type': 'Fire', 'value': '×2'}]","[{'type': 'Psychic', 'value': '-20'}]",3,Mitsuhiro Arita,Rare Holo,It has the power to control time. It appears in Sinnoh-region myths as an ancient deity.,"{'small': 'https://images.pokemontcg.io/pl1/5.png', 'large': 'https://images.pokemontcg.io/pl1/5_hires.png'}"
basep-2,Electabuzz,60,['Lightning'],,"[{'type': 'Fighting', 'value': '×2'}]",,2,Ken Sugimori,Promo,"A wild Pokémon with a short temper. It is able to distinguish colors, and likes the color red.","{'small': 'https://images.pokemontcg.io/basep/2.png', 'large': 'https://images.pokemontcg.io/basep/2_hires.png'}"
hgss2-1,Jirachi,60,['Psychic'],"[{'name': 'Stardust Song', 'text': 'Once during your turn, when you put Jirachi from your hand onto your Bench, you may flip 3 coins. For each heads, search your discard pile for a Psychic Energy card and attach it to Jirachi.', 'type': 'Poké-Power'}]","[{'type': 'Psychic', 'value': '×2'}]",,1,Wataru Kawahara,Rare Holo,Generations have believed that any wish written on a note on its head will come true when it awakens.,"{'small': 'https://images.pokemontcg.io/hgss2/1.png', 'large': 'https://images.pokemontcg.io/hgss2/1_hires.png'}"
basep-1,Pikachu,60,['Lightning'],,"[{'type': 'Fighting', 'value': '×2'}]",,1,Keiji Kinebuchi,Promo,"When several of these Pokémon gather, their electricity could build and cause lightning storms.","{'small': 'https://images.pokemontcg.io/basep/1.png', 'large': 'https://images.pokemontcg.io/basep/1_hires.png'}"
pop4-1,Chimecho δ,60,['Metal'],,"[{'type': 'Psychic', 'value': '×2'}]",,1,Masakazu Fukuda,Rare,,"{'small': 'https://images.pokemontcg.io/pop4/1.png', 'large': 'https://images.pokemontcg.io/pop4/1_hires.png'}"
pl4-1,Charizard,140,['Fire'],"[{'name': 'Fire Formation', 'text': ""Each of Charizard's attacks does 10 more damage for each Fire Pokémon on your Bench to your opponent's Active Pokémon (before applying Weakness and Resistance)."", 'type': 'Poké-Body'}]","[{'type': 'Water', 'value': '+30'}]","[{'type': 'Fighting', 'value': '-20'}]",3,Kagemaru Himeno,Rare Holo,,"{'small': 'https://images.pokemontcg.io/pl4/1.png', 'large': 'https://images.pokemontcg.io/pl4/1_hires.png'}"
ex9-3,Exploud,120,['Colorless'],,"[{'type': 'Fighting', 'value': '×2'}]",,2,Hajime Kusajima,Rare Holo,,"{'small': 'https://images.pokemontcg.io/ex9/3.png', 'large': 'https://images.pokemontcg.io/ex9/3_hires.png'}"
pop6-4,Pachirisu,70,['Lightning'],,"[{'type': 'Fighting', 'value': '+20'}]","[{'type': 'Metal', 'value': '-20'}]",1,Atsuko Nishida,Rare,It makes fur balls that crackle with static electricity. It stores them with berries in tree holes.,"{'small': 'https://images.pokemontcg.io/pop6/4.png', 'large': 'https://images.pokemontcg.io/pop6/4_hires.png'}"
ex4-2,Team Aqua's Crawdaunt,80,"['Water', 'Darkness']",,"[{'type': 'Lightning', 'value': '×2'}]",,1,Nakaoka,Rare Holo,,"{'small': 'https://images.pokemontcg.io/ex4/2.png', 'large': 'https://images.pokemontcg.io/ex4/2_hires.png'}"
xy4-2,Venomoth,90,['Grass'],,"[{'type': 'Fire', 'value': '×2'}]",,1,5ban Graphics,Rare,"The scales it scatters will paralyze anyone who touches them, making that person unable to stand.","{'small': 'https://images.pokemontcg.io/xy4/2.png', 'large': 'https://images.pokemontcg.io/xy4/2_hires.png'}"
pl1-4,Delcatty,90,['Colorless'],"[{'name': 'Power Circulation', 'text': ""Once during your turn (before your attack), you may search your discard pile for up to 2 basic Energy cards, show them to your opponent, and put those cards on top of your deck in any order. If you do, put 2 damage counters on Delcatty. This power can't be used if Delcatty is affected by a Special Condition."", 'type': 'Poké-Power'}]","[{'type': 'Fighting', 'value': '+20'}]",,1,Mitsuhiro Arita,Rare Holo,,"{'small': 'https://images.pokemontcg.io/pl1/4.png', 'large': 'https://images.pokemontcg.io/pl1/4_hires.png'}"
swsh35-3,Kakuna,80,['Grass'],,"[{'type': 'Fire', 'value': '×2'}]",,3,Miki Tanaka,Common,"While awaiting evolution, it hides from predators under leaves and in nooks of branches.","{'small': 'https://images.pokemontcg.io/swsh35/3.png', 'large': 'https://images.pokemontcg.io/swsh35/3_hires.png'}"
base5-2,Dark Arbok,60,['Grass'],,"[{'type': 'Psychic', 'value': '×2'}]",,2,Mitsuhiro Arita,Rare Holo,"Freezes its prey with its stare. If you should encounter one, remember not to look into its eyes.","{'small': 'https://images.pokemontcg.io/base5/2.png', 'large': 'https://images.pokemontcg.io/base5/2_hires.png'}"
pop5-2,Lugia,80,['Psychic'],,"[{'type': 'Psychic', 'value': '×2'}]",,2,Mitsuhiro Arita,Rare,,"{'small': 'https://images.pokemontcg.io/pop5/2.png', 'large': 'https://images.pokemontcg.io/pop5/2_hires.png'}"
dp4-2,Cresselia,80,['Psychic'],,"[{'type': 'Psychic', 'value': '+20'}]",,1,Ryo Ueda,Rare Holo,Shiny particles are released from its wings like a veil. It is said to represent the crescent moon.,"{'small': 'https://images.pokemontcg.io/dp4/2.png', 'large': 'https://images.pokemontcg.io/dp4/2_hires.png'}"
pop3-2,Flareon,70,['Fire'],,"[{'type': 'Water', 'value': '×2'}]",,1,Masakazu Fukuda,Rare,,"{'small': 'https://images.pokemontcg.io/pop3/2.png', 'large': 'https://images.pokemontcg.io/pop3/2_hires.png'}"
pop9-2,Manaphy,70,['Water'],,"[{'type': 'Lightning', 'value': '+20'}]",,1,Masakazu Fukuda,Rare,It is born with a wondrous power that lets it bond with any kind of Pokémon.,"{'small': 'https://images.pokemontcg.io/pop9/2.png', 'large': 'https://images.pokemontcg.io/pop9/2_hires.png'}"
sm5-2,Yanma,70,['Grass'],,"[{'type': 'Lightning', 'value': '×2'}]","[{'type': 'Fighting', 'value': '-20'}]",1,Akira Komayama,Common,"If it flaps its wings really fast, it can generate shock waves that will shatter windows in the area.","{'small': 'https://images.pokemontcg.io/sm5/2.png', 'large': 'https://images.pokemontcg.io/sm5/2_hires.png'}"
bw5-3,Venusaur,140,['Grass'],"[{'name': 'Floral Fragrance', 'text': 'Once during your turn (before your attack), you may search your deck for a Pokémon, reveal it, and put it into your hand. Shuffle your deck afterward.', 'type': 'Ability'}]","[{'type': 'Fire', 'value': '×2'}]","[{'type': 'Water', 'value': '-20'}]",4,Masakazu Fukuda,Rare Holo,"After a rainy day, the flower on its back smells stronger. The scent attracts other Pokémon.","{'small': 'https://images.pokemontcg.io/bw5/3.png', 'large': 'https://images.pokemontcg.io/bw5/3_hires.png'}"
ex12-5,Gengar,100,['Psychic'],"[{'name': 'Shadow Curse', 'text': ""If Gengar would be Knocked Out by damage from an opponent's attack, you may put 3 damage counters on 1 of your opponent's Pokémon."", 'type': 'Poké-Power'}]","[{'type': 'Darkness', 'value': '×2'}]","[{'type': 'Fighting', 'value': '-30'}]",1,Kouki Saitou,Rare Holo,,"{'small': 'https://images.pokemontcg.io/ex12/5.png', 'large': 'https://images.pokemontcg.io/ex12/5_hires.png'}"
pl4-3,Heatran,100,['Fire'],,"[{'type': 'Water', 'value': '×2'}]",,3,Keiko Moritsugu,Rare Holo,"Its body is made of rugged steel. However, it is partially melted in spots because of its own heat.","{'small': 'https://images.pokemontcg.io/pl4/3.png', 'large': 'https://images.pokemontcg.io/pl4/3_hires.png'}"
bw10-4,Cradily,120,['Grass'],,"[{'type': 'Fire', 'value': '×2'}]","[{'type': 'Water', 'value': '-20'}]",2,kawayoo,Rare,"It lives in the shallows of warm seas. When the tide goes out, it digs up prey from beaches.","{'small': 'https://images.pokemontcg.io/bw10/4.png', 'large': 'https://images.pokemontcg.io/bw10/4_hires.png'}"
pop4-3,Flygon,120,['Fighting'],"[{'name': 'Levitate', 'text': 'As long as Flygon has any Energy attached to it, the Retreat Cost for Flygon is 0.', 'type': 'Poké-Body'}]","[{'type': 'Water', 'value': '×2'}]",,2,Hisao Nakamura,Rare,,"{'small': 'https://images.pokemontcg.io/pop4/3.png', 'large': 'https://images.pokemontcg.io/pop4/3_hires.png'}"
ex9-4,Gardevoir,100,['Psychic'],"[{'name': 'Heal Dance', 'text': ""Once during your turn (before your attack), you may remove 2 damage counter from 1 of your Pokémon. You can't use more than 1 Heal Dance Poké-Power each turn. This power can't be used if Gardevoir is affected by a Special Condition."", 'type': 'Poké-Power'}]","[{'type': 'Psychic', 'value': '×2'}]",,2,Kagemaru Himeno,Rare Holo,,"{'small': 'https://images.pokemontcg.io/ex9/4.png', 'large': 'https://images.pokemontcg.io/ex9/4_hires.png'}"
dp4-3,Darkrai,70,['Darkness'],,"[{'type': 'Fighting', 'value': '+20'}]","[{'type': 'Psychic', 'value': '-20'}]",1,Masakazu Fukuda,Rare Holo,It can lull people to sleep and make them dream. It is active during nights of the new moon.,"{'small': 'https://images.pokemontcg.io/dp4/3.png', 'large': 'https://images.pokemontcg.io/dp4/3_hires.png'}"
ecard2-H5,Bellossom,90,['Grass'],"[{'name': 'Flower Supplement', 'text': ""Once during your turn (before your attack), you may flip a coin. If heads, attach 1 basic Energy card from your hand to 1 of your Benched Pokémon. This power can't be used if Bellossom is affected by a Special Condition."", 'type': 'Poké-Power'}]","[{'type': 'Fire', 'value': '×2'}]","[{'type': 'Water', 'value': '-30'}]",2,Sumiyoshi Kizuki,Rare Holo,,"{'small': 'https://images.pokemontcg.io/ecard2/H5.png', 'large': 'https://images.pokemontcg.io/ecard2/H5_hires.png'}"
pop1-3,Rayquaza,80,['Colorless'],,"[{'type': 'Colorless', 'value': '×2'}]",,1,Katsura Tabata,Rare,,"{'small': 'https://images.pokemontcg.io/pop1/3.png', 'large': 'https://images.pokemontcg.io/pop1/3_hires.png'}"
xy4-3,Yanma,70,['Grass'],,"[{'type': 'Lightning', 'value': '×2'}]","[{'type': 'Fighting', 'value': '-20'}]",1,Shin Nagasawa,Common,Its eyes can see 360 degrees without moving its head. It won't miss prey—even those behind it.,"{'small': 'https://images.pokemontcg.io/xy4/3.png', 'large': 'https://images.pokemontcg.io/xy4/3_hires.png'}"
bw11-3,Shuckle,80,['Grass'],,"[{'type': 'Fire', 'value': '×2'}]",,1,MAHOU,Uncommon,"The berries stored in its vaselike shell eventually become a thick, pulpy juice.","{'small': 'https://images.pokemontcg.io/bw11/3.png', 'large': 'https://images.pokemontcg.io/bw11/3_hires.png'}"
pop7-4,Latios,90,['Colorless'],,"[{'type': 'Colorless', 'value': '+20'}]","[{'type': 'Fighting', 'value': '-20'}]",2,Daisuke Ito,Rare,"A highly intelligent Pokémon. By folding back its wings in flight, it can overtake jet planes.","{'small': 'https://images.pokemontcg.io/pop7/4.png', 'large': 'https://images.pokemontcg.io/pop7/4_hires.png'}"
xy1-1,Venusaur-EX,180,['Grass'],,"[{'type': 'Fire', 'value': '×2'}]",,4,Eske Yoshinob,Rare Holo EX,,"{'small': 'https://images.pokemontcg.io/xy1/1.png', 'large': 'https://images.pokemontcg.io/xy1/1_hires.png'}"
neo3-1,Ampharos,90,['Lightning'],,"[{'type': 'Fighting', 'value': '×2'}]",,3,Toshinao Aoki,Rare Holo,The bright light on its tail can be seen far away. It has been treasured since ancient times as a beacon.,"{'small': 'https://images.pokemontcg.io/neo3/1.png', 'large': 'https://images.pokemontcg.io/neo3/1_hires.png'}"
bw5-2,Ivysaur,90,['Grass'],,"[{'type': 'Fire', 'value': '×2'}]","[{'type': 'Water', 'value': '-20'}]",3,sui,Uncommon,"When the bud on its back starts swelling, a sweet aroma wafts to indicate the flower's coming bloom.","{'small': 'https://images.pokemontcg.io/bw5/2.png', 'large': 'https://images.pokemontcg.io/bw5/2_hires.png'}"
sm2-2,Weepinbell,80,['Grass'],,"[{'type': 'Fire', 'value': '×2'}]",,2,Mina Nakai,Uncommon,The leafy parts act as cutters for slashing foes. It spits a fluid that dissolves everything.,"{'small': 'https://images.pokemontcg.io/sm2/2.png', 'large': 'https://images.pokemontcg.io/sm2/2_hires.png'}"
bw7-2,Gloom,80,['Grass'],,"[{'type': 'Fire', 'value': '×2'}]","[{'type': 'Water', 'value': '-20'}]",1,Atsuko Nishida,Uncommon,"The honey it drools from its mouth smells so atrocious, it can curl noses more than a mile away.","{'small': 'https://images.pokemontcg.io/bw7/2.png', 'large': 'https://images.pokemontcg.io/bw7/2_hires.png'}"
dv1-4,Dragonair,70,['Dragon'],,"[{'type': 'Dragon', 'value': '×2'}]",,2,Kagemaru Himeno,Rare Holo,"If its body takes on an aura, the weather changes instantly. It is said to live in seas and lakes.","{'small': 'https://images.pokemontcg.io/dv1/4.png', 'large': 'https://images.pokemontcg.io/dv1/4_hires.png'}"
dp1-2,Dusknoir,120,['Psychic'],"[{'name': 'Dark Palm', 'text': ""Once during your turn (before your attack), if your opponent has 4 or more Benched Pokémon, you may choose 1 of them and shuffle that Pokémon and all cards attached to it into his or her deck. This power can't be used if Dusknoir if affected by a Special Condition."", 'type': 'Poké-Power'}]","[{'type': 'Darkness', 'value': '+30'}]","[{'type': 'Colorless', 'value': '-20'}]",3,Takabon,Rare Holo,The antenna on its head captures radio waves from the world of spirits that command it to take people there.,"{'small': 'https://images.pokemontcg.io/dp1/2.png', 'large': 'https://images.pokemontcg.io/dp1/2_hires.png'}"
dp3-4,Entei,80,['Fire'],"[{'name': 'Burning Coat', 'text': ""Whenever 1 of your opponent's Pokémon is Knocked Out by damage from Entei's attacks, discard the top 3 cards from your opponent's deck."", 'type': 'Poké-Body'}]","[{'type': 'Water', 'value': '+20'}]",,2,Ryo Ueda,Rare Holo,"It is said that when it roars, a volcano erupts somewhere around the globe.","{'small': 'https://images.pokemontcg.io/dp3/4.png', 'large': 'https://images.pokemontcg.io/dp3/4_hires.png'}"
xy11-3,Hoppip,40,['Grass'],,"[{'type': 'Fire', 'value': '×2'}]",,1,Mina Nakai,Common,"It drifts on winds. It is said that when Hoppip gather in fields and mountains, spring is on the way.","{'small': 'https://images.pokemontcg.io/xy11/3.png', 'large': 'https://images.pokemontcg.io/xy11/3_hires.png'}"
swsh1-2,Roselia,70,['Grass'],,"[{'type': 'Fire', 'value': '×2'}]",,1,sowsow,Common,"Its flowers give off a relaxing fragrance. The stronger its aroma, the healthier the Roselia is.","{'small': 'https://images.pokemontcg.io/swsh1/2.png', 'large': 'https://images.pokemontcg.io/swsh1/2_hires.png'}"
bw4-2,Seedot,40,['Grass'],,"[{'type': 'Fire', 'value': '×2'}]","[{'type': 'Water', 'value': '-20'}]",1,Kagemaru Himeno,Common,"When it dangles from a tree branch, it looks just like an acorn. It enjoys scaring other Pokémon.","{'small': 'https://images.pokemontcg.io/bw4/2.png', 'large': 'https://images.pokemontcg.io/bw4/2_hires.png'}"
sm9-4,Kakuna,80,['Grass'],"[{'name': 'Grass Cushion', 'text': 'If this Pokémon has any Grass Energy attached to it, it takes 30 less damage from attacks (after applying Weakness and Resistance).', 'type': 'Ability'}]","[{'type': 'Fire', 'value': '×2'}]",,3,Yuka Morii,Uncommon,"Almost incapable of moving, this Pokémon can only harden its shell to protect itself when it is in danger.","{'small': 'https://images.pokemontcg.io/sm9/4.png', 'large': 'https://images.pokemontcg.io/sm9/4_hires.png'}"
ex10-1,Ampharos,120,['Lightning'],"[{'name': 'Energy Connect', 'text': ""As often as you like during your turn (before your attack), you may move a basic Energy card attached to 1 of your Benched Pokémon to your Active Pokémon. This power can't be used if Ampharos is affected by a Special Condition."", 'type': 'Poké-Power'}]","[{'type': 'Fighting', 'value': '×2'}]","[{'type': 'Metal', 'value': '-30'}]",2,Kyoko Umemoto,Rare Holo,,"{'small': 'https://images.pokemontcg.io/ex10/1.png', 'large': 'https://images.pokemontcg.io/ex10/1_hires.png'}"
dp1-3,Electivire,100,['Lightning'],"[{'name': 'Intense Voltage', 'text': ""As often as you like during your turn (before your attack), if Elekid is anywhere under Electivire, you may move a Lightning Energy attached to your Pokémon to Electivire. This power can't be used if Electivire is affected by a Special Condition."", 'type': 'Poké-Power'}]","[{'type': 'Fighting', 'value': '+20'}]","[{'type': 'Metal', 'value': '-20'}]",3,Nakaoka,Rare Holo,"It pushes the tips of its two tails against the foe, then lets loose with over 20,000 volts of power.","{'small': 'https://images.pokemontcg.io/dp1/3.png', 'large': 'https://images.pokemontcg.io/dp1/3_hires.png'}"
sm12-3,Gloom,80,['Grass'],,"[{'type': 'Fire', 'value': '×2'}]",,2,sui,Uncommon,"Smells incredibly foul! However, around one out of a thousand people enjoy sniffing its nose-bending stink.","{'small': 'https://images.pokemontcg.io/sm12/3.png', 'large': 'https://images.pokemontcg.io/sm12/3_hires.png'}"
hgss1-5,Hitmontop,60,['Fighting'],,"[{'type': 'Psychic', 'value': '×2'}]",,1,Ken Sugimori,Rare Holo,"It launches kicks while spinning. If it spins at high speed, it may bore its way into the ground.","{'small': 'https://images.pokemontcg.io/hgss1/5.png', 'large': 'https://images.pokemontcg.io/hgss1/5_hires.png'}"
ex3-5,Golem,120,['Fighting'],,"[{'type': 'Water', 'value': '×2'}]",,4,Hisao Nakamura,Rare Holo,,"{'small': 'https://images.pokemontcg.io/ex3/5.png', 'large': 'https://images.pokemontcg.io/ex3/5_hires.png'}"
ex4-3,Team Aqua's Kyogre,100,"['Water', 'Darkness']","[{'name': 'Power Saver', 'text': ""As long as the number of Pokémon in play (both yours and your opponent's) that has Team Aqua in its name is 3 or less, Team Aqua's Kyogre can't attack."", 'type': 'Poké-Body'}]","[{'type': 'Grass', 'value': '×2'}]",,3,K. Hoshiba,Rare Holo,,"{'small': 'https://images.pokemontcg.io/ex4/3.png', 'large': 'https://images.pokemontcg.io/ex4/3_hires.png'}"
dv1-5,Dragonite,150,['Dragon'],,"[{'type': 'Dragon', 'value': '×2'}]",,3,Mitsuhiro Arita,Rare Holo,It is said to make its home somewhere in the sea. It guides crews of shipwrecks to shore.,"{'small': 'https://images.pokemontcg.io/dv1/5.png', 'large': 'https://images.pokemontcg.io/dv1/5_hires.png'}"
dp3-5,Flygon,120,['Fighting'],"[{'name': 'Irritating Buzz', 'text': ""As long as Flygon is your Active Pokémon, put 1 damage counter on each of your opponent's Active Pokémon between turns, excluding Fighting Pokémon."", 'type': 'Poké-Body'}]","[{'type': 'Water', 'value': '+30'}]","[{'type': 'Lightning', 'value': '-20'}]",1,Daisuke Ito,Rare Holo,"It whips up sandstorms with powerful flaps of its wings. It is known as ""The Desert Spirit.""","{'small': 'https://images.pokemontcg.io/dp3/5.png', 'large': 'https://images.pokemontcg.io/dp3/5_hires.png'}"
bw1-3,Servine,80,['Grass'],,"[{'type': 'Fire', 'value': '×2'}]","[{'type': 'Water', 'value': '-20'}]",1,Kagemaru Himeno,Uncommon,They avoid attacks by sinking into the shadows of thick foliage. They retaliate with masterful whipping techniques.,"{'small': 'https://images.pokemontcg.io/bw1/3.png', 'large': 'https://images.pokemontcg.io/bw1/3_hires.png'}"
ex8-3,Breloom,80,['Fighting'],,"[{'type': 'Psychic', 'value': '×2'}]",,1,Hajime Kusajima,Rare Holo,,"{'small': 'https://images.pokemontcg.io/ex8/3.png', 'large': 'https://images.pokemontcg.io/ex8/3_hires.png'}"
neo3-2,Blissey,120,['Colorless'],"[{'name': 'Softboiled', 'text': 'When you play Blissey from your hand, you may flip a coin. If heads, remove 8 damage counters from Blissey. If tails, remove 4 damage counters from Blissey. Either way, if Blissey has fewer damage counters than that, remove all of them.', 'type': 'Pokémon Power'}]","[{'type': 'Fighting', 'value': '×2'}]","[{'type': 'Psychic', 'value': '-30'}]",2,Yuka Morii,Rare Holo,Anyone who takes even one bite of Blissey's egg becomes unfailingly caring and pleasant to everyone.,"{'small': 'https://images.pokemontcg.io/neo3/2.png', 'large': 'https://images.pokemontcg.io/neo3/2_hires.png'}"
neo4-3,Dark Donphan,60,['Fighting'],,"[{'type': 'Grass', 'value': '×2'}]","[{'type': 'Lightning', 'value': '-30'}]",3,Shin-ichi Yoshida,Rare Holo,"The larger its tusks, the higher its status in the herd.","{'small': 'https://images.pokemontcg.io/neo4/3.png', 'large': 'https://images.pokemontcg.io/neo4/3_hires.png'}"
