id,name,hp,types,abilities,weaknesses,resistances,convertedRetreatCost,artist,rarity,flavorText,images
bw7-3,Vileplume,140,['Grass'],"[{'name': 'Allergy Panic', 'text': ""Apply Weakness for each Pokémon (both yours and your opponent's) as ×4 instead."", 'type': 'Ability'}]","[{'type': 'Fire', 'value': '×2'}]","[{'type': 'Water', 'value': '-20'}]",3,Shin Nagasawa,Rare Holo,"Its petals are the largest in the world. As it walks, it scatters extremely allergenic pollen.","{'small': 'https://images.pokemontcg.io/bw7/3.png', 'large': 'https://images.pokemontcg.io/bw7/3_hires.png'}"
dpp-DP03,Piplup,60,['Water'],,"[{'type': 'Lightning', 'value': '+10'}]",,1,Atsuko Nishida,Promo,"Because it is very proud, it hates accepting food from people. Its thick down guards it from cold.","{'small': 'https://images.pokemontcg.io/dpp/DP03.png', 'large': 'https://images.pokemontcg.io/dpp/DP03_hires.png'}"
sm115-4,Paras,70,['Grass'],,"[{'type': 'Fire', 'value': '×2'}]",,1,OOYAMA,Common,"Whether it's due to a lack of moisture or a lack of nutrients, in Alola the mushrooms on Paras don't grow up quite right.","{'small': 'https://images.pokemontcg.io/sm115/4.png', 'large': 'https://images.pokemontcg.io/sm115/4_hires.png'}"
xy2-5,Seedot,50,['Grass'],,"[{'type': 'Fire', 'value': '×2'}]",,1,Naoyo Kimura,Common,It attaches itself to a tree branch using the top of its head. Strong winds can sometimes make it fall.,"{'small': 'https://images.pokemontcg.io/xy2/5.png', 'large': 'https://images.pokemontcg.io/xy2/5_hires.png'}"
ex14-2,Blastoise δ,110,"['Fighting', 'Metal']","[{'name': 'Shield Veil', 'text': 'Each of your Active Pokémon has no Weakness.', 'type': 'Poké-Body'}]","[{'type': 'Lightning', 'value': '×2'}]",,3,Masakazu Fukuda,Rare Holo,,"{'small': 'https://images.pokemontcg.io/ex14/2.png', 'large': 'https://images.pokemontcg.io/ex14/2_hires.png'}"
det1-5,Charizard,180,['Fire'],,"[{'type': 'Water', 'value': '×2'}]",,3,Framestore,Rare Ultra,"When expelling a blast of superhot fire, the red flame at the tip of its tail burns more intensely.","{'small': 'https://images.pokemontcg.io/det1/5.png', 'large': 'https://images.pokemontcg.io/det1/5_hires.png'}"
pl1-6,Dialga,100,['Metal'],"[{'name': 'Time Aura', 'text': ""As long as Dialga is your Active Pokémon, your opponent can't play any Pokémon from his or her hand to evolve his or her Active Pokémon."", 'type': 'Poké-Body'}]","[{'type': 'Fire', 'value': '+20'}]","[{'type': 'Psychic', 'value': '-20'}]",2,Kouki Saitou,Rare Holo,It has the power to control time. It appears in Sinnoh-region myths as an ancient deity.,"{'small': 'https://images.pokemontcg.io/pl1/6.png', 'large': 'https://images.pokemontcg.io/pl1/6_hires.png'}"
dpp-DP04,Pachirisu,70,['Lightning'],,"[{'type': 'Fighting', 'value': '+20'}]","[{'type': 'Metal', 'value': '-20'}]",1,Atsuko Nishida,Promo,It makes fur balls that crackle with static electricity. It stores them with berries in tree holes.,"{'small': 'https://images.pokemontcg.io/dpp/DP04.png', 'large': 'https://images.pokemontcg.io/dpp/DP04_hires.png'}"
xy5-5,Tangrowth,130,['Grass'],,"[{'type': 'Fire', 'value': '×2'}]",,4,MAHOU,Rare,"Its vines grow so profusely that, in the warm season, you can't even see its eyes.","{'small': 'https://images.pokemontcg.io/xy5/5.png', 'large': 'https://images.pokemontcg.io/xy5/5_hires.png'}"
xy2-6,Nuzleaf,80,['Grass'],,"[{'type': 'Fire', 'value': '×2'}]",,1,Midori Harada,Uncommon,The sound of its grass flute makes its listeners uneasy. It lives deep in forests.,"{'small': 'https://images.pokemontcg.io/xy2/6.png', 'large': 'https://images.pokemontcg.io/xy2/6_hires.png'}"
ex14-3,Camerupt,80,['Fire'],"[{'name': 'Delta Protection', 'text': ""Any damage done to Camerupt by attacks from your opponent's Pokémon that has δ on its card is reduced by 40 (after applying Weakness and Resistance)."", 'type': 'Poké-Body'}]","[{'type': 'Water', 'value': '×2'}]",,2,Mitsuhiro Arita,Rare Holo,,"{'small': 'https://images.pokemontcg.io/ex14/3.png', 'large': 'https://images.pokemontcg.io/ex14/3_hires.png'}"
base5-3,Dark Blastoise,70,['Water'],,"[{'type': 'Lightning', 'value': '×2'}]",,2,Mitsuhiro Arita,Rare Holo,An aggressive Pokémon that tackles anything it sees.,"{'small': 'https://images.pokemontcg.io/base5/3.png', 'large': 'https://images.pokemontcg.io/base5/3_hires.png'}"
neo4-4,Dark Espeon,60,['Psychic'],,"[{'type': 'Psychic', 'value': '×2'}]",,,Atsuko Nishida,Rare Holo,The tips of its split tail quiver whenever it uses its psychic abilities to read its opponent's next move.,"{'small': 'https://images.pokemontcg.io/neo4/4.png', 'large': 'https://images.pokemontcg.io/neo4/4_hires.png'}"
hgss4-6,Nidoking,140,['Fighting'],"[{'name': 'Pheromone Stamina', 'text': 'Nidoking gets +20 HP for each Nidoqueen you have in play.', 'type': 'Poké-Body'}]","[{'type': 'Water', 'value': '×2'}]","[{'type': 'Lightning', 'value': '-20'}]",3,match,Rare Holo,"Its tail is thick and powerful. If it binds an enemy, it can render the victim helpless quite easily.","{'small': 'https://images.pokemontcg.io/hgss4/6.png', 'large': 'https://images.pokemontcg.io/hgss4/6_hires.png'}"
bw8-3,Torterra,150,['Grass'],,"[{'type': 'Fire', 'value': '×2'}]","[{'type': 'Water', 'value': '-20'}]",4,5ban Graphics,Rare,Some Pokémon are born on a Torterra's back and spend their entire life there.,"{'small': 'https://images.pokemontcg.io/bw8/3.png', 'large': 'https://images.pokemontcg.io/bw8/3_hires.png'}"
sm75-3,Charizard,160,['Fire'],"[{'name': 'Resolute Flame', 'text': ""This Pokémon's attacks do 30 more damage to your opponent's Active Pokémon for each of their Pokémon-GX and Pokémon-EX in play."", 'type': 'Ability'}]","[{'type': 'Water', 'value': '×2'}]",,2,Ryota Murayama,Rare Holo,"Its wings can carry this Pokémon close to an altitude of 4,600 feet. It blows out fire at very high temperatures.","{'small': 'https://images.pokemontcg.io/sm75/3.png', 'large': 'https://images.pokemontcg.io/sm75/3_hires.png'}"
xy11-5,Jumpluff,90,['Grass'],,"[{'type': 'Fire', 'value': '×2'}]",,1,Suwama Chiaki,Rare,"Even in the fiercest wind, it can control its fluff to make its way to any place in the world it wants.","{'small': 'https://images.pokemontcg.io/xy11/5.png', 'large': 'https://images.pokemontcg.io/xy11/5_hires.png'}"
det1-6,Arcanine,120,['Fire'],"[{'name': 'Security Guard', 'text': ""As long as this Pokémon is your Active Pokémon, all of your Pokémon take 30 less damage from your opponent's attacks (after applying Weakness and Resistance)."", 'type': 'Ability'}]","[{'type': 'Water', 'value': '×2'}]",,3,MPC Film,Rare,Legends tell of its fighting alongside a general and conquering a whole country.,"{'small': 'https://images.pokemontcg.io/det1/6.png', 'large': 'https://images.pokemontcg.io/det1/6_hires.png'}"
bw9-2,Kakuna,80,['Grass'],,"[{'type': 'Fire', 'value': '×2'}]",,2,match,Uncommon,"While awaiting evolution, it hides from predators under leaves and in nooks of branches.","{'small': 'https://images.pokemontcg.io/bw9/2.png', 'large': 'https://images.pokemontcg.io/bw9/2_hires.png'}"
pop3-4,Minun,50,['Lightning'],,"[{'type': 'Fighting', 'value': '×2'}]","[{'type': 'Metal', 'value': '-30'}]",1,Sumiyoshi Kizuki,Rare,,"{'small': 'https://images.pokemontcg.io/pop3/4.png', 'large': 'https://images.pokemontcg.io/pop3/4_hires.png'}"
bw4-4,Kricketune,90,['Grass'],,"[{'type': 'Fire', 'value': '×2'}]",,1,Naoyo Kimura,Uncommon,There is a village that hosts a contest based on the amazingly variable cries of this Pokémon.,"{'small': 'https://images.pokemontcg.io/bw4/4.png', 'large': 'https://images.pokemontcg.io/bw4/4_hires.png'}"
hgss1-6,Jumpluff,90,['Grass'],,"[{'type': 'Fire', 'value': '×2'}]","[{'type': 'Fighting', 'value': '-20'}]",,sui,Rare Holo,"Once it catches the wind, it deftly controls its cotton-puff spores—it can even float around the world.","{'small': 'https://images.pokemontcg.io/hgss1/6.png', 'large': 'https://images.pokemontcg.io/hgss1/6_hires.png'}"
sm12-4,Vileplume-GX,240,['Grass'],"[{'name': 'Fragrant Flower Garden', 'text': 'Once during your turn (before your attack), you may heal 30 damage from each of your Pokémon.', 'type': 'Ability'}]","[{'type': 'Fire', 'value': '×2'}]",,2,Kagemaru Himeno,Rare Holo GX,,"{'small': 'https://images.pokemontcg.io/sm12/4.png', 'large': 'https://images.pokemontcg.io/sm12/4_hires.png'}"
xy5-6,Treecko,60,['Grass'],,"[{'type': 'Fire', 'value': '×2'}]",,1,Akira Komayama,Common,Small hooks on the bottom of its feet catch on walls and ceilings. That is how it can hang from above.,"{'small': 'https://images.pokemontcg.io/xy5/6.png', 'large': 'https://images.pokemontcg.io/xy5/6_hires.png'}"
gym2-5,Giovanni's Gyarados,90,['Water'],,"[{'type': 'Grass', 'value': '×2'}]","[{'type': 'Fighting', 'value': '-30'}]",3,Ken Sugimori,Rare Holo,,"{'small': 'https://images.pokemontcg.io/gym2/5.png', 'large': 'https://images.pokemontcg.io/gym2/5_hires.png'}"
base4-5,Clefable,70,['Colorless'],,"[{'type': 'Fighting', 'value': '×2'}]","[{'type': 'Psychic', 'value': '-30'}]",2,Mitsuhiro Arita,Rare Holo,A timid Fairy Pokémon that is rarely seen. It will run and hide the moment it senses people.,"{'small': 'https://images.pokemontcg.io/base4/5.png', 'large': 'https://images.pokemontcg.io/base4/5_hires.png'}"